Sheet: Spring 2014
A1: Spring budget 2014 | C1: EXPENSES | H1: Balance | I1: of:=[.H89]-[.H5] -> 85311.2198514302
H2: of:=IF([.H5]=([.H9]+[.H37]+[.H40]+[.H51]);"kontrola ok";"kontrolní součet nesedí") -> kontrola ok
C3: Common | D3: UX | E3: FCD | F3: GEP | G3: DP | H3: TOTAL
A4: BALANCE | D4: of:=[.D6]-[.D5] -> -2073.1514935989 | E4: of:=[.E6]-[.E5] -> 13496.773431326 | F4: of:=[.F6]-[.F5] -> 48205.6863442389 | G4: of:=[.G6]-[.G5] -> 25681.9115694641 | I4: % | J4: REALITY | K4: REMAINS
A5: TOTAL COST | C5: of:=[.C9]+[.C37]+[.C40]+[.C51] -> 212186.984352774 | D5: of:=[.D9]+[.D37]+[.D40]+[.D51] -> 92523.1514935989 | E5: of:=[.E9]+[.E37]+[.E40]+[.E51] -> 177453.226568674 | F5: of:=[.F9]+[.F37]+[.F40]+[.F51] -> 152794.313655761 | G5: of:=[.G9]+[.G37]+[.G40]+[.G51] -> 135118.088430536 | H5: of:=SUM([.D5:.G5]) -> 557888.78014857 | I5: of:=[.H5]/[.$H$5] -> 1 | J5: of:=[.J9]+[.J37]+[.J40]+[.J51] -> 321688 | K5: of:=[.H5]-[.J5] -> 236200.78014857
A6: TOTAL REVENUE | D6: of:=[.D89] -> 90450 | E6: of:=[.E89] -> 190950 | F6: of:=[.F89] -> 201000 | G6: of:=[.G89] -> 160800 | H6: of:=SUM([.D6:.G6]) -> 643200
B7: Size | D7: 1 | E7: 1 | F7: 1 | G7: 1 | H7: of:=SUM([.D7:.G7]) -> 4
B8: Percent for fixed exp. | D8: of:=[.D7]/[.$H$7] -> 0.25 | E8: of:=[.E7]/[.$H$7] -> 0.25 | F8: of:=[.F7]/[.$H$7] -> 0.25 | G8: of:=[.G7]/[.$H$7] -> 0.25
A9: Fixed costs | C9: of:=[.C10]+[.C11]+[.C16]+[.C17]+[.C20]+[.C21]+[.C28]+[.C29]+[.C33]+[.C34] -> 212186.984352774 | D9: of:=[.$C9]*[.D$8] -> 53046.7460881935 | E9: of:=[.$C9]*[.E$8] -> 53046.7460881935 | F9: of:=[.$C9]*[.F$8] -> 53046.7460881935 | G9: of:=[.$C9]*[.G$8] -> 53046.7460881935 | H9: of:=[.C9] -> 212186.984352774 | I9: of:=[.H9]/[.H$5] -> 0.380339221549261 | J9: 170532 | K9: of:=[.H9]-[.J9] -> 41654.984352774
A10: Rent | C10: of:=11400*12/3 -> 45600 | I10: of:=[.$C10]/[.H$5] -> 0.0817367217671171
A11: Utilities | C11: of:=SUM([.C12:.C15]) -> 9791.89189189189 | I11: of:=[.$C11]/[.H$5] -> 0.0175516917355539
B12: Internet +fixed phone | C12: 3000
B13: Mobile phone | C13: of:=1500+2*4*500/USDCZK -> 1716.21621621622
B14: Electricity | C14: 3000
B15: Gas | C15: of:=96000*1.2/USDCZK/3 -> 2075.67567567568
A16: Library | C16: 2300 | I16: of:=[.$C16]/[.H$5] -> 0.0041226855277274
A17: Office supplies | C17: of:=SUM([.C18:.C19]) -> 10500 | I17: of:=[.$C17]/[.H$5] -> 0.0188209556700599
B18: Other supplies | C18: 8000
B19: Cleaning supplies | C19: 2500
A20: Director travel | C20: of:=3000+1500 -> 4500 | I20: of:=[.$C20]/[.H$5] -> 0.00806612385859708
A21: Services | C21: of:=SUM([.C22:.C24]) -> 11554.0540540541 | I21: of:=[.$C21]/[.H$5] -> 0.0207103180153169
B22: Bookkeeper | C22: of:=(34+22)/2*1000/USDCZK*4 -> 6054.05405405405 | I22: of:=[.$C22]/[.H$5] -> 0.0108517221881426
B23: IT Services | C23: 3000 | J23: [http://prague.sod.ncsu.edu/splits/balance?epoch=5e74a8f2-7db0-4010-94eb-7fcc3f355c01&account=3a778562-b7c4-4aec-9e9f-3c2a8a730fd8]
B24: Repairs | C24: 2500 | J24: http://prague.sod.ncsu.edu/splits/balance?epoch=5e74a8f2-7db0-4010-94eb-7fcc3f355c01&account=3a778562-b7c4-4aec-9e9f-3c2a8a730fd8
B25: Transportation | C25: 500
B26: Restaurant | C26: 800
B27: Other services | C27: 800
A28: Miscellaneous | C28: 2000 | I28: of:=[.$C28]/[.H$5] -> 0.00358494393715426
A29: Employees | C29: of:=SUM([.C30:.C31]) -> 70748.6486486486 | I29: of:=[.$C29]/[.H$5] -> 0.126814969517415
B30: Employees | C30: of:=(4*269400/USDCZK) -> 58248.6486486487
B31: + additional help | C31: 12500
B32: Security company | C32: of:=(150/USDCZK)*30*[.C71] -> 3162.16216216216
A33: Taxes (employees+institute) | C33: of:=[.C29]/0.76*(1.34-0.76) -> 53992.3897581792 | I33: of:=[.$C33]/[.H$5] -> 0.0967798451580271
A34: Banking fees | C34: of:=SUM([.C35:.C36]) -> 1200
B35: US | C35: 1000
B36: Czech | C36: 200
A37: Program specific | C37: of:=[.C38]+[.C39] -> 0 | D37: of:=[.D38]+[.D39] -> 2000 | E37: of:=[.E38]+[.E39] -> 5000 | F37: of:=[.F38]+[.F39] -> 0 | G37: of:=[.G38]+[.G39] -> 6000 | H37: of:=SUM([.C37:.G37]) -> 13000 | I37: of:=[.H37]/[.H$5] -> 0.0233021355915027 | J37: 3503 | K37: of:=[.H37]-[.J37] -> 9497
A38: Program specific equip/suppl | D38: 2000 | E38: 5000 | F38: 0 | G38: 6000 | H38: of:=SUM([.C38:.G38]) -> 13000 | I38: of:=[.H38]/[.H$5] -> 0.0233021355915027
A40: Students | C40: of:=SUM([.C42:.C49])*[.C76] -> 0 | D40: of:=SUM([.D42:.D49])*[.D76] -> 31476.4054054054 | E40: of:=SUM([.E42:.E49])*[.E76] -> 66450.1891891892 | F40: of:=SUM([.F42:.F49])*[.F76] -> 69947.5675675676 | G40: of:=SUM([.G42:.G49])*[.G76] -> 55958.0540540541 | H40: of:=SUM([.C40:.G40]) -> 223832.216216216 | I40: of:=[.H40]/[.H$5] -> 0.401212973232062 | J40: of:=SUM([.J41:.J49]) -> 76828 | K40: of:=[.H40]-[.J40] -> 147004.216216216
A41: per student | D41: of:=SUM([.D42:.D49]) -> 3497.37837837838 | E41: of:=SUM([.E42:.E49]) -> 3497.37837837838 | F41: of:=SUM([.F42:.F49]) -> 3497.37837837838 | G41: of:=SUM([.G42:.G49]) -> 3497.37837837838 | H41: of:=[.D41]*[.D$76]+[.E41]*[.E$76]+[.F41]*[.F$76]+[.G41]*[.G$76] -> 223832.216216216
A42: Students supplies * | D42: 90 | E42: of:=[.$D42] -> 90 | F42: of:=[.$D42] -> 90 | G42: of:=[.$D42] -> 90 | H42: of:=[.D42]*[.D$76]+[.E42]*[.E$76]+[.F42]*[.F$76]+[.G42]*[.G$76] -> 5760 | I42: of:=[.H42]/[.H$5] -> 0.0103246385390043 | J42: 0
A43: Housing * | D43: of:=[.D70]*[.D74] -> 1605.40540540541 | E43: of:=[.E70]*[.E74] -> 1605.40540540541 | F43: of:=[.F70]*[.F74] -> 1605.40540540541 | G43: of:=[.G70]*[.G74] -> 1605.40540540541 | H43: of:=[.D43]*[.D$76]+[.E43]*[.E$76]+[.F43]*[.F$76]+[.G43]*[.G$76] -> 102745.945945946 | I43: of:=[.H43]/[.H$5] -> 0.184169227993049 | J43: 34907
A44: Orientation * | D44: 25 | E44: of:=[.$D44] -> 25 | F44: of:=[.$D44] -> 25 | G44: of:=[.$D44] -> 25 | H44: of:=[.D44]*[.D$76]+[.E44]*[.E$76]+[.F44]*[.F$76]+[.G44]*[.G$76] -> 1600 | I44: of:=[.H44]/[.H$5] -> 0.00286795514972341 | J44: 1696
A45: Travel pass * | D45: of:=IF([.D70]<30;550+240;IF([.D70]<60;1100+240;1480+240))/USDCZK -> 92.972972972973 | E45: of:=IF([.E70]<30;550+240;IF([.E70]<60;1100+240;1480+240))/USDCZK -> 92.972972972973 | F45: of:=IF([.F70]<30;550+240;IF([.F70]<60;1100+240;1480+240))/USDCZK -> 92.972972972973 | G45: of:=IF([.G70]<30;550+240;IF([.G70]<60;1100+240;1480+240))/USDCZK -> 92.972972972973 | H45: of:=[.D45]*[.D$76]+[.E45]*[.E$76]+[.F45]*[.F$76]+[.G45]*[.G$76] -> 5950.27027027027 | I45: of:=[.H45]/[.H$5] -> 0.0106656926649173 | J45: 5260 | K45: of:=[.H45]-[.J45] -> 690.27027027027
A46: Culture * | D46: of:=[.D71]*50/4 -> 162.5 | E46: of:=[.E71]*50/4 -> 162.5 | F46: of:=[.F71]*50/4 -> 162.5 | G46: of:=[.G71]*50/4 -> 162.5 | H46: of:=[.D46]*[.D$76]+[.E46]*[.E$76]+[.F46]*[.F$76]+[.G46]*[.G$76] -> 10400 | I46: of:=[.H46]/[.H$5] -> 0.0186417084732021
A47: Excursions * | D47: 1000 | E47: 1000 | F47: 1000 | G47: 1000 | H47: of:=[.D47]*[.D$76]+[.E47]*[.E$76]+[.F47]*[.F$76]+[.G47]*[.G$76] -> 64000 | I47: of:=[.H47]/[.H$5] -> 0.114718205988936 | J47: 34965 | K47: of:=[.H47]-[.J47] -> 29035
A48: Health Insurance * | D48: of:=[.$C$80]*[.D70] -> 121.5 | E48: of:=[.$C$80]*[.E70] -> 121.5 | F48: of:=[.$C$80]*[.F70] -> 121.5 | G48: of:=[.$C$80]*[.G70] -> 121.5 | H48: of:=[.D48]*[.D$76]+[.E48]*[.E$76]+[.F48]*[.F$76]+[.G48]*[.G$76] -> 7776 | I48: of:=[.H48]/[.H$5] -> 0.0139382620276558
A49: Study abroad fee * | D49: 400 | E49: 400 | F49: 400 | G49: 400 | H49: of:=[.D49]*[.D$76]+[.E49]*[.E$76]+[.F49]*[.F$76]+[.G49]*[.G$76] -> 25600 | I49: of:=[.H49]/[.H$5] -> 0.0458872823955745
A51: Faculty | D51: of:=[.D52]+[.D58] -> 6000 | E51: of:=[.E52]+[.E58] -> 52956.2912912913 | F51: of:=[.F52]+[.F58] -> 29800 | G51: of:=[.G52]+[.G58] -> 20113.2882882883 | H51: of:=SUM([.C51:.G51]) -> 108869.57957958 | I51: of:=[.H51]/[.H$5] -> 0.195145669627173 | J51: 70825 | K51: of:=[.H51]-[.J51] -> 38044.5795795796
A52: Czech | D52: of:=SUM([.D53:.D57]) -> 6000 | E52: of:=SUM([.E53:.E57]) -> 28427.7777777778 | F52: of:=SUM([.F53:.F57]) -> 29800 | G52: of:=SUM([.G53:.G57]) -> 13479.1666666667 | H52: of:=SUM([.C52:.G52]) -> 77706.9444444445 | I52: of:=[.H52]/[.H$5] -> 0.139287519680447
B53: Salaries | D53: of:=[.$A$127] -> 6000 | E53: of:=[.$A$128] -> 23777.7777777778 | F53: of:=[.$A$129] -> 29800 | G53: of:=[.$A$130] -> 7666.66666666667 | H53: of:=SUM([.C53:.G53]) -> 67244.4444444444 | I53: of:=[.H53]/[.H$5] -> 0.120533781709209
B54: Other | D54: of:=1*([.D$64]+[.D$65]) -> 0 | E54: of:=4*([.E$64]+[.E$65]) -> 4650 | F54: of:=3*([.F$64]+[.F$65]) -> 0 | G54: of:=3*([.G$64]+[.G$65]) -> 3487.5 | H54: of:=SUM([.C54:.G54]) -> 8137.5 | I54: of:=[.H54]/[.H$5] -> 0.0145862406442964
A55: Instructors / guest speakers
B56: Salaries | D56: 0 | E56: 0 | F56: 0 | G56: 0
B57: Other | D57: of:=0*([.D$64]+[.D$65]) -> 0 | E57: of:=0*([.E$64]+[.E$65]) -> 0 | F57: of:=0*([.F$64]+[.F$65]) -> 0 | G57: of:=2*([.G$64]+[.G$65]) -> 2325
A58: US | D58: of:=[.D77]*[.D60]+[.D59] -> 0 | E58: of:=[.E77]*[.E60]+[.E59] -> 24528.5135135135 | F58: of:=[.F77]*[.F60]+[.F59] -> 0 | G58: of:=[.G77]*[.G60]+[.G59] -> 6634.12162162162 | H58: of:=SUM([.C58:.G58]) -> 31162.6351351351 | I58: of:=[.H58]/[.H$5] -> 0.0558581499467264
B59: Workshop total | E59: of:=(15270-[.E61]-[.E62])+35000/USDCZK -> 12660.2702702703 | H59: of:=SUM([.C59:.G59]) -> 12660.2702702703
A60: per faculty | D60: of:=SUM([.D61:.D67]) -> 0 | E60: of:=SUM([.E61:.E67]) -> 5934.12162162162 | F60: of:=SUM([.F61:.F67]) -> 0 | G60: of:=SUM([.G61:.G67]) -> 6634.12162162162 | H60: of:=[.D60]*[.D$77]+[.E60]*[.E$77]+[.F60]*[.F$77]+[.G60]*[.G$77] -> 18502.3648648649 | I60: of:=[.H60]/[.H$5] -> 0.0331649703726567
B61: Salaries + benefit ** | D61: 0 | E61: 3200 | F61: 0 | G61: 3900 | H61: of:=[.D61]*[.D$77]+[.E61]*[.E$77]+[.F61]*[.F$77]+[.G61]*[.G$77] -> 10300 | I61: of:=[.H61]/[.H$5] -> 0.0184624612763444
B62: Travel** | D62: 0 | E62: of:=1200+[.E78] -> 1301.62162162162 | F62: 0 | G62: of:=1200+[.G78] -> 1301.62162162162 | H62: of:=[.D62]*[.D$77]+[.E62]*[.E$77]+[.F62]*[.F$77]+[.G62]*[.G$77] -> 3904.86486486486 | I62: of:=[.H62]/[.H$5] -> 0.00699936081135198
B63: Perdiem** | D63: 0 | E63: 0 | F63: 0 | G63: 0 | H63: of:=[.D63]*[.D$77]+[.E63]*[.E$77]+[.F63]*[.F$77]+[.G63]*[.G$77] -> 0 | I63: of:=[.H63]/[.H$5] -> 0
B64: Culture** | D64: 0 | E64: of:=[.E46] -> 162.5 | F64: 0 | G64: of:=[.G46] -> 162.5 | H64: of:=[.D64]*[.D$77]+[.E64]*[.E$77]+[.F64]*[.F$77]+[.G64]*[.G$77] -> 487.5 | I64: of:=[.H64]/[.H$5] -> 0.00087383008468135
B65: Excursion** | D65: 0 | E65: of:=[.E47] -> 1000 | F65: 0 | G65: of:=[.G47] -> 1000 | H65: of:=[.D65]*[.D$77]+[.E65]*[.E$77]+[.F65]*[.F$77]+[.G65]*[.G$77] -> 3000 | I65: of:=[.H65]/[.H$5] -> 0.00537741590573139
B66: Housing** | D66: 0 | E66: 0 | F66: 0 | G66: 0 | H66: of:=[.D66]*[.D$77]+[.E66]*[.E$77]+[.F66]*[.F$77]+[.G66]*[.G$77] -> 0 | I66: of:=[.H66]/[.H$5] -> 0
B67: Health insurance** | D67: 0 | E67: of:=[.$C$81]*[.E70] -> 270 | F67: 0 | G67: of:=[.$C$81]*[.G70] -> 270 | H67: of:=[.D67]*[.D$77]+[.E67]*[.E$77]+[.F67]*[.F$77]+[.G67]*[.G$77] -> 810 | I67: of:=[.H67]/[.H$5] -> 0.00145190229454747
A69: Other info
A70: Length (days) | C70: 90 | D70: of:=[.C70] -> 90 | E70: of:=[.D70] -> 90 | F70: of:=[.E70] -> 90 | G70: of:=[.F70] -> 90
A71: Length (weeks) | C71: of:=ROUND([.C70]/7;0) -> 13 | D71: of:=ROUND([.D70]/7;0) -> 13 | E71: of:=ROUND([.E70]/7;0) -> 13 | F71: of:=ROUND([.F70]/7;0) -> 13 | G71: of:=ROUND([.G70]/7;0) -> 13
A72: Starting date
A73: Ending date
A74: Housing cost / day / student | C74: of:=ACCOM/USDCZK -> 17.8378378378378 | D74: of:=ACCOM/USDCZK -> 17.8378378378378 | E74: of:=ACCOM/USDCZK -> 17.8378378378378 | F74: of:=ACCOM/USDCZK -> 17.8378378378378 | G74: of:=ACCOM/USDCZK -> 17.8378378378378
A75: USD / CZK minimum | C75: 17
A76: No. of students | D76: 9 | E76: 19 | F76: 20 | G76: 16
A77: No. US of faculty | D77: 0 | E77: 2 | F77: 0 | G77: 1
A78: Travel pass cost / person | D78: of:=IF([.D70]<30;670;IF([.D70]<60;2*670;1880))/USDCZK -> 101.621621621622 | E78: of:=IF([.E70]<30;670;IF([.E70]<60;2*670;1880))/USDCZK -> 101.621621621622 | F78: of:=IF([.F70]<30;670;IF([.F70]<60;2*670;1880))/USDCZK -> 101.621621621622 | G78: of:=IF([.G70]<30;670;IF([.G70]<60;2*670;1880))/USDCZK -> 101.621621621622
A79: Housing cost / day / faculty | C79: of:=900/USDCZK -> 48.6486486486487
A80: Health insurance | C80: 1.35
A81: Health insurance / faculty | C81: 3
A83: * per student cost
A84: **per faculty cost
A86: of:=[.A1] -> Spring budget 2014 | C86: INCOME
C88: Common | D88: LAR | E88: FCD | H88: TOTAL
A89: TOTAL | C89: of:=SUM([.C91:.C92]) -> 0 | D89: of:=SUM([.D91:.D92]) -> 90450 | E89: of:=SUM([.E91:.E92]) -> 190950 | F89: of:=SUM([.F91:.F92]) -> 201000 | G89: of:=SUM([.G91:.G92]) -> 160800 | H89: of:=SUM([.C89:.G89]) -> 643200
A90: Students income per student | D90: of:=9650+400 -> 10050 | E90: of:=9650+400 -> 10050 | F90: of:=9650+400 -> 10050 | G90: of:=9650+400 -> 10050
A91: Students income - total | C91: of:=[.C90]*[.C76] -> 0 | D91: of:=[.D90]*[.D76] -> 90450 | E91: of:=[.E90]*[.E76] -> 190950 | F91: of:=[.F90]*[.F76] -> 201000 | G91: of:=[.G90]*[.G76] -> 160800 | H91: of:=SUM([.C91:.G91]) -> 643200
A92: Gifts | H92: of:=SUM([.C92:.G92]) -> 0
A96: to budget | B96: name | C96: course | D96: paid from | E96: High Point contributes
A97: 3200 | B97: Pavla | C97: GEP | D97: CZ
A98: 3000 | B98: Jablonská | C98: GEP | D98: CZ | E98: 3000
A99: 6000 | B99: Hellebrandová | C99: GEP | D99: CZ | E99: 3000
A100: 3000 | B100: Lenka D. | C100: GEP | D100: CZ
A101: 3800 | B101: Vojtěchovský | C101: DP | D101: CZ | E101: 800
A102: 3000 | B102: Matěj Král | C102: GEP | D102: CZ
A103: 3200 | B103: Beneš | C103: DP | D103: CZ | E103: 200
A104: 3000 | B104: Břečka | C104: UX | D104: CZ
A105: 2200 | B105: Paseková | C105: GEP | D105: CZ | E105: 2200
A106: 3000 | B106: Votápková | C106: GEP | D106: CZ
A107: 11000 | B107: Tučna | C107: FCD | D107: CZ
A108: 11000 | B108: Tachezyová | C108: FCD | D108: CZ
A109: 3200 | B109: Dalibor | C109: GEP | D109: CZ
A110: 1700 | B110: Maděra | C110: GEP | D110: CZ
A111: 3000 | B111: Ibl | C111: UX | D111: CZ | F111: ..
A112: 1500 | B112: Černovský | C112: GEP | D112: CZ | F112: ..
A113: 666.666666666667 | B113: Vano | C113: DP | D113: CZ
A114: 888.888888888889 | B114: Pavla Dydovičová | C114: FCD | D114: CZ
A115: 888.888888888889 | B115: Bára Kafková | C115: FCD | D115: CZ
A119: 15270 | B119: Anderson | D119: USA | F119: FCD
A120: 3200 | B120: Moskal | D120: USA | F120: FCD
A121: 3200 | B121: Rosenblum | D121: USA | F121: DP
A123: of:=SUMIF([.D$97:.D$115];"CZ";[.A$97:.A$115]) -> 67244.4444444444 | B123: SUM CZ
A124: of:=SUM([.A119:.A121]) -> 21670 | B124: SUM EN
A125: of:=SUM([.A123:.A124]) -> 88914.4444444444 | B125: SUM
A127: of:=SUMIF([.C$97:.C$121];[.B127];[.A$97:.A$121]) -> 6000 | B127: UX
A128: of:=SUMIF([.C$97:.C$121];[.B128];[.A$97:.A$121]) -> 23777.7777777778 | B128: FCD
A129: of:=SUMIF([.C$97:.C$121];[.B129];[.A$97:.A$121]) -> 29800 | B129: GEP
A130: of:=SUMIF([.C$97:.C$121];[.B130];[.A$97:.A$121]) -> 7666.66666666667 | B130: DP

Sheet: Summer 2014
A1: Summer budget 2014 | C1: EXPENSES | J1: Balance | K1: of:=[.J82]-[.J5] -> -97271.2475106678
J2: of:=IF([.J5]=([.J9]+[.J37]+[.J41]+[.J50]);"kontrola ok";"kontrolní součet nesedí") -> kontrola ok
C3: Common | D3: ID | E3: DF | F3: WC | G3: GEP | H3: ENG | I3: MAC | J3: TOTAL | K3: %
A4: BALANCE | D4: of:=[.D6]-[.D5] -> -45397.0711237553 | E4: of:=[.E6]-[.E5] -> -39564.9427453768 | F4: of:=[.F6]-[.F5] -> -32399.2535561876 | G4: of:=[.G6]-[.G5] -> -53663.93598862 | H4: of:=[.H6]-[.H5] -> 73753.9559032719 | I4: of:=[.I6]-[.I5] -> 0
A5: TOTAL COST | C5: of:=[.C9]+[.C37]+[.C41]+[.C50] -> 226992.517780938 | D5: of:=[.D9]+[.D37]+[.D41]+[.D50] -> 90197.0711237552 | E5: of:=[.E9]+[.E37]+[.E41]+[.E50] -> 67564.9427453768 | F5: of:=[.F9]+[.F37]+[.F41]+[.F50] -> 71599.2535561876 | G5: of:=[.G9]+[.G37]+[.G41]+[.G50] -> 154463.93598862 | H5: of:=[.H9]+[.H37]+[.H41]+[.H50] -> 150246.044096728 | I5: of:=[.I9]+[.I37]+[.I41]+[.I50] -> 0 | J5: of:=SUM([.D5:.I5]) -> 534071.247510668 | K5: of:=[.J5]/[.J$5] -> 1
A6: TOTAL REVENUE | D6: of:=[.D82] -> 44800 | E6: of:=[.E82] -> 28000 | F6: of:=[.F82] -> 39200 | G6: of:=[.G82] -> 100800 | H6: of:=[.H82] -> 224000 | I6: of:=[.I82] -> 0 | J6: of:=SUM([.D6:.I6]) -> 436800 | K6: of:=[.J6]/[.J$5] -> 0.817868406202255
B7: Size | D7: 1 | E7: 1 | F7: 1 | G7: 1 | H7: 1 | I7: 0 | J7: of:=SUM([.D7:.I7]) -> 5
B8: Percent for fixed exp. | D8: of:=[.D7]/[.$J$7] -> 0.2 | E8: of:=[.E7]/[.$J$7] -> 0.2 | F8: of:=[.F7]/[.$J$7] -> 0.2 | G8: of:=[.G7]/[.$J$7] -> 0.2 | H8: of:=[.H7]/[.$J$7] -> 0.2 | I8: of:=[.I7]/[.$J$7] -> 0
A9: Fixed costs | C9: of:=[.C10]+[.C11]+[.C16]+[.C17]+[.C20]+[.C21]+[.C29]+[.C30]+[.C33]+[.C34] -> 224159.184447605 | D9: of:=[.$C5]*[.D$8] -> 45398.5035561876 | E9: of:=[.$C5]*[.E$8] -> 45398.5035561876 | F9: of:=[.$C5]*[.F$8] -> 45398.5035561876 | G9: of:=[.$C5]*[.G$8] -> 45398.5035561876 | H9: of:=[.$C5]*[.H$8] -> 45398.5035561876 | I9: of:=[.$C5]*[.I$8] -> 0 | J9: of:=[.C9] -> 224159.184447605 | K9: of:=[.J9]/[.J$5] -> 0.41971775393718 | L9: of:=[.J9]/159989-1 -> 0.401091227819447
A10: Rent | C10: of:=11400*12/3 -> 45600 | J10: of:=SUM([.C10:.I10]) -> 45600 | K10: of:=[.J10]/[.J$5] -> 0.0853818665815541 | M10: to budget | N10: name | O10: course | P10: paid from
A11: Utilities | C11: of:=SUM([.C12:.C15]) -> 8556.75675675676 | J11: of:=SUM([.C11:.I11]) -> 8556.75675675676 | K11: of:=[.J11]/[.J$5] -> 0.0160217513986013 | M11: 3000 | N11: Corey | O11: ID | P11: USA
B12: Internet +landline | C12: of:=1000+4*5000/USDCZK+500 -> 2581.08108108108 | J12: of:=SUM([.C12:.I12]) -> 2581.08108108108 | M12: 3000 | N12: Katzhatoorian | O12: ID | P12: USA
B13: Mobile phone | C13: 1500 | J13: of:=SUM([.C13:.I13]) -> 1500 | M13: 6000 | N13: Cecilia | O13: DF | P13: USA
B14: Electricity | C14: of:=6000/3*1.2 -> 2400 | J14: of:=SUM([.C14:.I14]) -> 2400 | M14: 6000 | N14: Dallas | O14: WC | P14: USA
B15: Gas | C15: of:=96000*1.2/USDCZK/3 -> 2075.67567567568 | J15: of:=SUM([.C15:.I15]) -> 2075.67567567568 | M15: 6000 | N15: Rasdorf | O15: ENG | P15: USA
A16: Library | C16: of:=8200/3*1.2 -> 3280 | J16: of:=SUM([.C16:.I16]) -> 3280 | K16: of:=[.J16]/[.J$5] -> 0.00614150268393635
A17: Office supplies | C17: of:=SUM([.C18:.C19]) -> 12600 | J17: of:=SUM([.C17:.I17]) -> 12600 | K17: of:=[.J17]/[.J$5] -> 0.0235923578712189 | M17: 3000 | N17: Gordon | O17: GEP | P17: USA
B18: Other supplies | C18: of:=34200/3 -> 11400 | J18: of:=SUM([.C18:.I18]) -> 11400 | L18: << split Computers | M18: 3000 | N18: Cherry | O18: GEP | P18: USA
B19: Cleaning supplies | C19: 1200 | J19: of:=SUM([.C19:.I19]) -> 1200 | M19: 3000 | N19: Bohlman | O19: GEP | P19: USA
A20: Director travel | C20: of:=8000/3 -> 2666.66666666667 | J20: of:=SUM([.C20:.I20]) -> 2666.66666666667 | K20: of:=[.J20]/[.J$5] -> 0.00499309161295639
A21: Services | C21: of:=SUM([.C22:.C28]) -> 31324.3243243243 | J21: of:=SUM([.C21:.I21]) -> 31324.3243243243 | K21: of:=[.J21]/[.J$5] -> 0.058651957899491
B22: Bookkeeper | C22: of:=4*100000/USDCZK -> 21621.6216216216 | J22: of:=SUM([.C22:.I22]) -> 21621.6216216216 | L22: << ask Dottie | M22: 3200 | N22: Jonssonová | O22: GEP | P22: CZ
B23: IT Services | C23: of:=60000/USDCZK -> 3243.24324324324 | J23: of:=SUM([.C23:.I23]) -> 3243.24324324324
B24: Repairs | C24: 2500 | J24: of:=SUM([.C24:.I24]) -> 2500 | M24: 3000 | N24: Milhone | O24: GEP | P24: USA
B25: Transportation | C25: 1000 | J25: of:=SUM([.C25:.I25]) -> 1000
B26: Restaurant | C26: 700 | J26: of:=SUM([.C26:.I26]) -> 700 | M26: 3000 | N26: Král | O26: GEP | P26: CZ
B27: Security company | C27: of:=(150/USDCZK)*30*[.C69] -> 1459.45945945946 | J27: of:=SUM([.C27:.I27]) -> 1459.45945945946 | M27: 3000 | N27: Bob | O27: GEP | P27: USA
B28: Other services | C28: 800 | J28: of:=SUM([.C28:.I28]) -> 800
A29: Miscellaneous | C29: 1000 | J29: of:=SUM([.C29:.I29]) -> 1000 | K29: of:=[.J29]/[.J$5] -> 0.00187240935485864 | M29: 6000 | N29: Seracino | O29: ENG | P29: USA
A30: Employees | C30: of:=SUM([.C31:.C32]) -> 66886.4864864865 | J30: of:=SUM([.C30:.I30]) -> 66886.4864864865 | K30: of:=[.J30]/[.J$5] -> 0.125238883010924
B31: Employees | C31: of:=(4*269000/USDCZK) -> 58162.1621621622 | J31: of:=SUM([.C31:.I31]) -> 58162.1621621622
B32: + Employee | C32: of:=(4*33000+4900*[.C69])/USDCZK -> 8724.32432432433 | J32: of:=SUM([.C32:.I32]) -> 8724.32432432433
A33: Taxes (employees+institute) | C33: of:=[.C30]/0.76*(1.34-0.76) -> 51044.9502133713 | J33: of:=SUM([.C33:.I33]) -> 51044.9502133713 | K33: of:=[.J33]/[.J$5] -> 0.0955770422978101 | M33: of:=SUMIF([.P$11:.P$32];[.N33];[.M$11:.M$32]) -> 6200 | N33: CZ
A34: Banking fees | C34: of:=SUM([.C35:.C36]) -> 1200 | J34: of:=SUM([.C34:.I34]) -> 1200 | K34: of:=[.J34]/[.J$5] -> 0.00224689122583037 | M34: of:=SUMIF([.P$11:.P$32];[.N34];[.M$11:.M$32]) -> 45000 | N34: USA
B35: US | C35: 1000 | J35: of:=SUM([.C35:.I35]) -> 1000 | M35: of:=SUM([.M33:.M34]) -> 51200 | N35: SUM
B36: Czech | C36: 200 | J36: of:=SUM([.C36:.I36]) -> 200
A37: US administration cost | C37: of:=SUM([.C38:.C40]) -> 2833.33333333333 | D37: of:=SUM([.D38:.D40]) -> 6880 | E37: of:=SUM([.E38:.E40]) -> 4300 | F37: of:=SUM([.F38:.F40]) -> 6020 | G37: of:=SUM([.G38:.G40]) -> 15480 | H37: of:=SUM([.H38:.H40]) -> 34400 | I37: of:=SUM([.I38:.I40]) -> 0 | J37: of:=SUM([.C37:.I37]) -> 69913.3333333333 | K37: of:=[.J37]/[.J$5] -> 0.130906379362684 | M37: of:=SUMIF([.O$11:.O$32];[.N37];[.M$11:.M$32]) -> 6000 | N37: ID | O37: of:=COUNTIF([.O$11:.O$32];[.N37]) -> 2
A38: University Administrative Fee | C38: of:=8500/3 -> 2833.33333333333 | J38: of:=SUM([.C38:.I38]) -> 2833.33333333333 | K38: of:=[.J38]/[.J$5] -> 0.00530515983876615 | M38: of:=SUMIF([.O$11:.O$32];[.N38];[.M$11:.M$32]) -> 6000 | N38: DF | O38: of:=COUNTIF([.O$11:.O$32];[.N38]) -> 1
A39: College of Design Administration | D39: of:=[.D84]*0.1 -> 4480 | E39: of:=[.E84]*0.1 -> 2800 | F39: of:=[.F84]*0.1 -> 3920 | G39: of:=[.G84]*0.1 -> 10080 | H39: of:=[.H84]*0.1 -> 22400 | I39: of:=[.I84]*0.1 -> 0 | J39: of:=SUM([.C39:.I39]) -> 43680 | K39: of:=[.J39]/[.J$5] -> 0.0817868406202255 | M39: of:=SUMIF([.O$11:.O$32];[.N39];[.M$11:.M$32]) -> 6000 | N39: WC | O39: of:=COUNTIF([.O$11:.O$32];[.N39]) -> 1
A40: Study abroad fee | D40: of:=[.D70]*[.D72] -> 2400 | E40: of:=[.E70]*[.E72] -> 1500 | F40: of:=[.F70]*[.F72] -> 2100 | G40: of:=[.G70]*[.G72] -> 5400 | H40: of:=[.H70]*[.H72] -> 12000 | I40: of:=[.I70]*[.I72] -> 0 | J40: of:=SUM([.C40:.I40]) -> 23400 | K40: of:=[.J40]/[.J$5] -> 0.0438143789036922 | M40: of:=SUMIF([.O$11:.O$32];[.N40];[.M$11:.M$32]) -> 21200 | N40: GEP | O40: of:=COUNTIF([.O$11:.O$32];[.N40]) -> 7
A41: Students | D41: of:=[.D43]*[.D72]+[.D42] -> 9257.24324324324 | E41: of:=[.E43]*[.E72]+[.E42] -> 5785.77702702703 | F41: of:=[.F43]*[.F72]+[.F42] -> 8100.08783783784 | G41: of:=[.G43]*[.G72]+[.G42] -> 20828.7972972973 | H41: of:=[.H43]*[.H72]+[.H42] -> 46286.2162162162 | I41: of:=[.I43]*[.I72]+[.I42] -> 0 | J41: of:=SUM([.C41:.I41]) -> 90258.1216216216 | K41: of:=[.J41]/[.J$5] -> 0.169000151276293 | M41: of:=SUMIF([.O$11:.O$32];[.N41];[.M$11:.M$32]) -> 12000 | N41: ENG | O41: of:=COUNTIF([.O$11:.O$32];[.N41]) -> 2
A42: Program specific equip/suppl | D42: 0 | E42: 0 | F42: 0 | G42: 0 | H42: 0 | I42: 0 | J42: of:=SUM([.C42:.I42]) -> 0 | K42: of:=[.J42]/[.J$5] -> 0 | M42: of:=SUMIF([.O$11:.O$32];[.N42];[.M$11:.M$32]) -> 0 | N42: MAC | O42: of:=COUNTIF([.O$11:.O$32];[.N42]) -> 0
A43: per student costs | D43: of:=SUM([.D44:.D49]) -> 1157.15540540541 | E43: of:=SUM([.E44:.E49]) -> 1157.15540540541 | F43: of:=SUM([.F44:.F49]) -> 1157.15540540541 | G43: of:=SUM([.G44:.G49]) -> 1157.15540540541 | H43: of:=SUM([.H44:.H49]) -> 1157.15540540541 | I43: of:=SUM([.I44:.I49]) -> 657.021621621622
B44: Other student expenses * | D44: 80 | E44: of:=[.$D44] -> 80 | F44: of:=[.$D44] -> 80 | G44: of:=[.$D44] -> 80 | H44: of:=[.$D44] -> 80 | I44: of:=[.$D44] -> 80 | J44: of:=SUMPRODUCT([.D44:.I44];[.D$72:.I$72]) -> 6240 | K44: of:=[.J44]/[.J$5] -> 0.0116838343743179
B45: Housing * | D45: of:=[.D68]*[.D71] -> 522.972972972973 | E45: of:=[.E68]*[.E71] -> 522.972972972973 | F45: of:=[.F68]*[.F71] -> 522.972972972973 | G45: of:=[.G68]*[.G71] -> 522.972972972973 | H45: of:=[.H68]*[.H71] -> 522.972972972973 | I45: of:=[.I68]*[.I71] -> 278.918918918919 | J45: of:=SUMPRODUCT([.D45:.I45];[.D$72:.I$72]) -> 40791.8918918919 | K45: of:=[.J45]/[.J$5] -> 0.0763791199807608
B46: Orientation * | D46: 25 | E46: of:=[.$D46] -> 25 | F46: of:=[.$D46] -> 25 | G46: of:=[.$D46] -> 25 | H46: of:=[.$D46] -> 25 | I46: of:=[.$D46] -> 25 | J46: of:=SUMPRODUCT([.D46:.I46];[.D$72:.I$72]) -> 1950 | K46: of:=[.J46]/[.J$5] -> 0.00365119824197435
B47: Travel pass * | D47: of:=IF([.D68]<30;550+240;IF([.D68]<60;1100+240;1480+240))/USDCZK -> 72.4324324324324 | E47: of:=IF([.E68]<30;550+240;IF([.E68]<60;1100+240;1480+240))/USDCZK -> 72.4324324324324 | F47: of:=IF([.F68]<30;550+240;IF([.F68]<60;1100+240;1480+240))/USDCZK -> 72.4324324324324 | G47: of:=IF([.G68]<30;550+240;IF([.G68]<60;1100+240;1480+240))/USDCZK -> 72.4324324324324 | H47: of:=IF([.H68]<30;550+240;IF([.H68]<60;1100+240;1480+240))/USDCZK -> 72.4324324324324 | I47: of:=IF([.I68]<30;550+240;IF([.I68]<60;1100+240;1480+240))/USDCZK -> 42.7027027027027 | J47: of:=SUMPRODUCT([.D47:.I47];[.D$72:.I$72]) -> 5649.72972972973 | K47: of:=[.J47]/[.J$5] -> 0.0105786067983689
B48: Culture & Excursions * | D48: of:=66*[.D69] -> 396 | E48: of:=66*[.E69] -> 396 | F48: of:=66*[.F69] -> 396 | G48: of:=66*[.G69] -> 396 | H48: of:=66*[.H69] -> 396 | I48: of:=66*[.I69] -> 198 | J48: of:=SUMPRODUCT([.D48:.I48];[.D$72:.I$72]) -> 30888 | K48: of:=[.J48]/[.J$5] -> 0.0578349801528738
B49: Health Insurance * | D49: of:=[.$C$76]*[.D68] -> 60.75 | E49: of:=[.$C$76]*[.E68] -> 60.75 | F49: of:=[.$C$76]*[.F68] -> 60.75 | G49: of:=[.$C$76]*[.G68] -> 60.75 | H49: of:=[.$C$76]*[.H68] -> 60.75 | I49: of:=[.$C$76]*[.I68] -> 32.4 | J49: of:=SUMPRODUCT([.D49:.I49];[.D$72:.I$72]) -> 4738.5 | K49: of:=[.J49]/[.J$5] -> 0.00887241172799768
A50: Faculty | D50: of:=[.D51]+[.D57] -> 28661.3243243244 | E50: of:=[.E51]+[.E57] -> 12080.6621621622 | F50: of:=[.F51]+[.F57] -> 12080.6621621622 | G50: of:=[.G51]+[.G57] -> 72756.6351351351 | H50: of:=[.H51]+[.H57] -> 24161.3243243243 | I50: of:=[.I51]+[.I57] -> 0 | J50: of:=SUM([.C50:.I50]) -> 149740.608108108 | K50: of:=[.J50]/[.J$5] -> 0.280375715423844
A51: Czech | D51: of:=SUM([.D52:.D56]) -> 5000 | E51: of:=SUM([.E52:.E56]) -> 0 | F51: of:=SUM([.F52:.F56]) -> 0 | G51: of:=SUM([.G52:.G56]) -> 10192 | H51: of:=SUM([.H52:.H56]) -> 0 | I51: of:=SUM([.I52:.I56]) -> 0 | J51: of:=SUM([.C51:.I51]) -> 15192 | K51: of:=[.J51]/[.J$5] -> 0.0284456429190125 | L51: of:=[.J51]/11600-1 -> 0.309655172413793
B52: Salaries | D52: 0 | E52: 0 | F52: 0 | G52: 6200 | H52: 0 | I52: 0 | J52: of:=SUM([.C52:.I52]) -> 6200 | K52: of:=[.J52]/[.J$5] -> 0.0116089380001236
B53: Other | D53: of:=0*([.D63]) -> 0 | E53: of:=0*([.E63]) -> 0 | F53: of:=0*([.F63]) -> 0 | G53: of:=2*[.G63] -> 792 | H53: of:=0*([.H63]) -> 0 | I53: of:=0*([.I63]) -> 0 | J53: of:=SUM([.C53:.I53]) -> 792 | K53: of:=[.J53]/[.J$5] -> 0.00148294820904805
A54: Guests
B55: Salaries | D55: 5000 | E55: 0 | F55: 0 | G55: 3200 | H55: 0 | I55: 0 | J55: of:=SUM([.C55:.I55]) -> 8200 | K55: of:=[.J55]/[.J$5] -> 0.0153537567098409
B56: Other | D56: of:=0*([.D63]) -> 0 | E56: of:=0*([.E63]) -> 0 | F56: of:=0*([.F63]) -> 0 | G56: of:=0*([.G63]) -> 0 | H56: of:=0*([.H63]) -> 0 | I56: of:=0*([.I63]) -> 0 | J56: of:=SUM([.C56:.I56]) -> 0 | K56: of:=[.J56]/[.J$5] -> 0
A57: US | D57: of:=[.D73]*[.D59]+[.D58] -> 23661.3243243244 | E57: of:=[.E73]*[.E59]+[.E58] -> 12080.6621621622 | F57: of:=[.F73]*[.F59]+[.F58] -> 12080.6621621622 | G57: of:=[.G73]*[.G59]+[.G58] -> 62564.6351351351 | H57: of:=[.H73]*[.H59]+[.H58] -> 24161.3243243243 | I57: of:=[.I73]*[.I59]+[.I58] -> 0 | J57: of:=SUM([.C57:.I57]) -> 134548.608108108 | K57: of:=[.J57]/[.J$5] -> 0.251930072504831
B58: Workshop total | D58: of:=-500 -> -500 | G58: -1000 | J58: of:=SUM([.C58:.I58]) -> -1500
A59: per faculty | D59: of:=SUM([.D60:.D65]) -> 12080.6621621622 | E59: of:=SUM([.E60:.E65]) -> 12080.6621621622 | F59: of:=SUM([.F60:.F65]) -> 12080.6621621622 | G59: of:=SUM([.G60:.G65]) -> 9080.66216216216 | H59: of:=SUM([.H60:.H65]) -> 12080.6621621622 | I59: of:=SUM([.I60:.I65]) -> 6974.32432432433 | J59: of:=SUMPRODUCT([.D59:.I59];[.D$73:.I$73]) -> 136048.608108108 | K59: of:=[.J59]/[.J$5] -> 0.254738686537119
B60: Salaries + benefit ** | D60: 6000 | E60: 6000 | F60: 6000 | G60: 3000 | H60: 6000 | I60: 3000 | J60: of:=SUMPRODUCT([.D60:.I60];[.D$73:.I$73]) -> 57000 | K60: of:=[.J60]/[.J$5] -> 0.106727333226943
B61: Travel** | D61: of:=1600+[.D74] -> 1672.97297297297 | E61: of:=1600+[.E74] -> 1672.97297297297 | F61: of:=1600+[.F74] -> 1672.97297297297 | G61: of:=1600+[.G74] -> 1672.97297297297 | H61: of:=1600+[.H74] -> 1672.97297297297 | I61: of:=1600+[.I74] -> 1636.75675675676 | J61: of:=SUMPRODUCT([.D61:.I61];[.D$73:.I$73]) -> 21748.6486486486 | K61: of:=[.J61]/[.J$5] -> 0.0407223731852634
B62: Perdiem** | D62: of:=37.5*[.D68] -> 1687.5 | E62: of:=37.5*[.E68] -> 1687.5 | F62: of:=37.5*[.F68] -> 1687.5 | G62: of:=37.5*[.G68] -> 1687.5 | H62: of:=37.5*[.H68] -> 1687.5 | I62: of:=37.5*[.I68] -> 900 | J62: of:=SUMPRODUCT([.D62:.I62];[.D$73:.I$73]) -> 21937.5 | K62: of:=[.J62]/[.J$5] -> 0.0410759802222115 | L62: << check with Dottie
B63: Culture & Excursions ** | D63: of:=[.D48] -> 396 | E63: of:=[.E48] -> 396 | F63: of:=[.F48] -> 396 | G63: of:=[.G48] -> 396 | H63: of:=[.H48] -> 396 | I63: of:=[.I48] -> 198 | J63: of:=SUMPRODUCT([.D63:.I63];[.D$73:.I$73]) -> 5148 | K63: of:=[.J63]/[.J$5] -> 0.00963916335881229
B64: Housing** | D64: of:=[.D68]*[.$C$75] -> 2189.18918918919 | E64: of:=[.E68]*[.$C$75] -> 2189.18918918919 | F64: of:=[.F68]*[.$C$75] -> 2189.18918918919 | G64: of:=[.G68]*[.$C$75] -> 2189.18918918919 | H64: of:=[.H68]*[.$C$75] -> 2189.18918918919 | I64: of:=[.I68]*[.$C$75] -> 1167.56756756757 | J64: of:=SUMPRODUCT([.D64:.I64];[.D$73:.I$73]) -> 28459.4594594595 | K64: of:=[.J64]/[.J$5] -> 0.0532877581261122
B65: Health insurance** | D65: of:=[.$C$77]*[.D68] -> 135 | E65: of:=[.$C$77]*[.E68] -> 135 | F65: of:=[.$C$77]*[.F68] -> 135 | G65: of:=[.$C$77]*[.G68] -> 135 | H65: of:=[.$C$77]*[.H68] -> 135 | I65: of:=[.$C$77]*[.I68] -> 72 | J65: of:=SUMPRODUCT([.D65:.I65];[.D$73:.I$73]) -> 1755 | K65: of:=[.J65]/[.J$5] -> 0.00328607841777692
A67: Other info
A68: Length (days) | C68: 45 | D68: of:=[.C68] -> 45 | E68: of:=[.D68] -> 45 | F68: of:=[.E68] -> 45 | G68: of:=[.F68] -> 45 | H68: of:=[.G68] -> 45 | I68: 24
A69: Length (weeks) | C69: of:=ROUND([.C68]/7;0) -> 6 | D69: of:=ROUND([.D68]/7;0) -> 6 | E69: of:=ROUND([.E68]/7;0) -> 6 | F69: of:=ROUND([.F68]/7;0) -> 6 | G69: of:=ROUND([.G68]/7;0) -> 6 | H69: of:=ROUND([.H68]/7;0) -> 6 | I69: of:=ROUND([.I68]/7;0) -> 3
A70: Study abroad fee | C70: 300 | D70: of:=[.C70] -> 300 | E70: of:=[.D70] -> 300 | F70: of:=[.E70] -> 300 | G70: of:=[.F70] -> 300 | H70: of:=[.G70] -> 300 | I70: of:=[.H70] -> 300
A71: Housing cost / day / student | C71: of:=ACCOMBOTIC/USDCZK -> 11.6216216216216 | D71: of:=[.C71] -> 11.6216216216216 | E71: of:=[.D71] -> 11.6216216216216 | F71: of:=[.E71] -> 11.6216216216216 | G71: of:=[.F71] -> 11.6216216216216 | H71: of:=[.G71] -> 11.6216216216216 | I71: of:=[.H71] -> 11.6216216216216
A72: No. of students | D72: 8 | E72: 5 | F72: 7 | G72: of:=6+5+6+1 -> 18 | H72: 40 | I72: 0 | J72: of:=SUM([.D72:.I72]) -> 78
A73: No. US of faculty | D73: 2 | E73: 1 | F73: 1 | G73: 7 | H73: 2 | I73: 0
A74: Travel pass cost / person | D74: of:=IF([.D68]<30;670+10;IF([.D68]<60;2*670+10;3*670+10))/USDCZK -> 72.972972972973 | E74: of:=IF([.E68]<30;670+10;IF([.E68]<60;2*670+10;3*670+10))/USDCZK -> 72.972972972973 | F74: of:=IF([.F68]<30;670+10;IF([.F68]<60;2*670+10;3*670+10))/USDCZK -> 72.972972972973 | G74: of:=IF([.G68]<30;670+10;IF([.G68]<60;2*670+10;3*670+10))/USDCZK -> 72.972972972973 | H74: of:=IF([.H68]<30;670+10;IF([.H68]<60;2*670+10;3*670+10))/USDCZK -> 72.972972972973 | I74: of:=IF([.I68]<30;670+10;IF([.I68]<60;2*670+10;3*670+10))/USDCZK -> 36.7567567567568
A75: Housing cost / day / faculty | C75: of:=900/USDCZK -> 48.6486486486487 | L75: ?17-20
A76: Health insurance / student | C76: 1.35 | L76: << check with Dottie
A77: Health insurance / faculty | C77: 3 | L77: << check with Dottie
A79: of:=[.A1] -> Summer budget 2014 | C79: INCOME
C81: Common | J81: TOTAL
A82: TOTAL | C82: of:=SUM([.C84:.C85]) -> 0 | D82: of:=SUM([.D84:.D85]) -> 44800 | E82: of:=SUM([.E84:.E85]) -> 28000 | F82: of:=SUM([.F84:.F85]) -> 39200 | G82: of:=SUM([.G84:.G85]) -> 100800 | H82: of:=SUM([.H84:.H85]) -> 224000 | I82: of:=SUM([.I84:.I85]) -> 0 | J82: of:=SUM([.C82:.I82]) -> 436800
A83: Students income per student | D83: of:=5300+300 -> 5600 | E83: of:=5300+300 -> 5600 | F83: of:=5300+300 -> 5600 | G83: of:=5300+300 -> 5600 | H83: of:=5300+300 -> 5600 | I83: of:=5300+300 -> 5600
A84: Students income - total | C84: of:=[.C83]*[.C72] -> 0 | D84: of:=[.D83]*[.D72] -> 44800 | E84: of:=[.E83]*[.E72] -> 28000 | F84: of:=[.F83]*[.F72] -> 39200 | G84: of:=[.G83]*[.G72] -> 100800 | H84: of:=[.H83]*[.H72] -> 224000 | I84: of:=[.I83]*[.I72] -> 0 | J84: of:=SUM([.C84:.I84]) -> 436800
A85: Gifts
A87: * per student cost
A88: **per faculty cost
A90: Venice | B90: workshop | C90: of:=70134+701 -> 70835 | D90: CZK
A91: Copenhagen | B91: cash exp. | C91: 4000 | D91: DKK
B92: P card | C92: of:=2841+4050 -> 6891 | D92: DKK

Sheet: Fall 2014
A1: Fall budget 2014 | C1: EXPENSES | H1: Balance | I1: of:=[.H82]-[.H5] -> 83280.072546231
H2: of:=IF([.H5]=([.H9]+[.H37]+[.H41]+[.H50]);"kontrola ok";"kontrolní součet nesedí") -> kontrola ok
C3: Common | D3: ARC | E3: LAR | F3: MC | G3: GEP | H3: TOTAL | I3: %
A4: BALANCE | D4: of:=[.D6]-[.D5] -> 103397.960170697 | E4: of:=[.E6]-[.E5] -> 2134.92034139424 | F4: of:=[.F6]-[.F5] -> 9951.92034139425 | G4: of:=[.G6]-[.G5] -> -32204.7283072545
A5: TOTAL COST | C5: of:=[.C9]+[.C37]+[.C41]+[.C50] -> 231964.210526315 | D5: of:=[.D9]+[.D37]+[.D41]+[.D50] -> 198102.039829303 | E5: of:=[.E9]+[.E37]+[.E41]+[.E50] -> 118465.079658606 | F5: of:=[.F9]+[.F37]+[.F41]+[.F50] -> 110648.079658606 | G5: of:=[.G9]+[.G37]+[.G41]+[.G50] -> 72404.7283072545 | H5: of:=SUM([.D5:.G5]) -> 499619.927453769 | I5: of:=[.H5]/[.H$5] -> 1
A6: TOTAL REVENUE | D6: of:=[.D82] -> 301500 | E6: of:=[.E82] -> 120600 | F6: of:=[.F82] -> 120600 | G6: of:=[.G82] -> 40200 | H6: of:=SUM([.D6:.G6]) -> 582900 | I6: of:=[.H6]/[.H$5] -> 1.16668685128444
B7: Size | D7: 1 | E7: 1 | F7: 1 | G7: 1 | H7: of:=SUM([.D7:.G7]) -> 4
B8: Percent for fixed exp. | D8: of:=[.D7]/[.$H$7] -> 0.25 | E8: of:=[.E7]/[.$H$7] -> 0.25 | F8: of:=[.F7]/[.$H$7] -> 0.25 | G8: of:=[.G7]/[.$H$7] -> 0.25
A9: Fixed costs | C9: of:=[.C10]+[.C11]+[.C16]+[.C17]+[.C20]+[.C21]+[.C29]+[.C30]+[.C33]+[.C34] -> 229130.877192982 | D9: of:=[.$C5]*[.D$8] -> 57991.0526315788 | E9: of:=[.$C5]*[.E$8] -> 57991.0526315788 | F9: of:=[.$C5]*[.F$8] -> 57991.0526315788 | G9: of:=[.$C5]*[.G$8] -> 57991.0526315788 | H9: of:=[.C9] -> 229130.877192982 | I9: of:=[.H9]/[.H$5] -> 0.458610364804122
A10: Rent | C10: of:=11400*12/3 -> 45600 | H10: of:=SUM([.A10:.G10]) -> 45600 | I10: of:=[.H10]/[.H$5] -> 0.0912693779697558
A11: Utilities | C11: of:=SUM([.C12:.C15]) -> 8556.75675675676 | H11: of:=SUM([.A11:.G11]) -> 8556.75675675676 | I11: of:=[.H11]/[.H$5] -> 0.017126532162888 | K11: Henry | L11: 6000
B12: Internet +fixed phone | C12: of:=1000+4*5000/USDCZK+500 -> 2581.08108108108 | H12: of:=SUM([.A12:.G12]) -> 2581.08108108108 | K12: Bitnar | L12: 3000
B13: Mobile phone | C13: 1500 | H13: of:=SUM([.A13:.G13]) -> 1500
B14: Electricity | C14: of:=6000/3*1.2 -> 2400 | H14: of:=SUM([.A14:.G14]) -> 2400
B15: Gas | C15: of:=96000*1.2/USDCZK/3 -> 2075.67567567568 | H15: of:=SUM([.A15:.G15]) -> 2075.67567567568
A16: Library | C16: of:=8200/3*1.2 -> 3280 | H16: of:=SUM([.A16:.G16]) -> 3280 | I16: of:=[.H16]/[.H$5] -> 0.00656499034519296
A17: Office supplies | C17: of:=SUM([.C18:.C19]) -> 12600 | H17: of:=SUM([.A17:.G17]) -> 12600 | I17: of:=[.H17]/[.H$5] -> 0.0252191702284851
B18: Other supplies | C18: of:=34200/3 -> 11400 | H18: of:=SUM([.A18:.G18]) -> 11400
B19: Cleaning supplies | C19: 1200 | H19: of:=SUM([.A19:.G19]) -> 1200
A20: Director travel | C20: of:=8000/3 -> 2666.66666666667 | H20: of:=SUM([.A20:.G20]) -> 2666.66666666667 | I20: of:=[.H20]/[.H$5] -> 0.00533739052454713
A21: Services | C21: of:=SUM([.C22:.C28]) -> 33027.027027027 | H21: of:=SUM([.A21:.G21]) -> 33027.027027027 | I21: of:=[.H21]/[.H$5] -> 0.0661043029155058
B22: Bookkeeper | C22: of:=4*100000/USDCZK -> 21621.6216216216 | H22: of:=SUM([.A22:.G22]) -> 21621.6216216216
B23: IT Services | C23: of:=60000/USDCZK -> 3243.24324324324 | H23: of:=SUM([.A23:.G23]) -> 3243.24324324324
B24: Repairs | C24: 2500 | H24: of:=SUM([.A24:.G24]) -> 2500
B25: Transportation | C25: 1000 | H25: of:=SUM([.A25:.G25]) -> 1000
B26: Restaurant | C26: 700 | H26: of:=SUM([.A26:.G26]) -> 700
B27: Security company | C27: of:=(150/USDCZK)*30*[.C69] -> 3162.16216216216 | H27: of:=SUM([.A27:.G27]) -> 3162.16216216216
B28: Other services | C28: 800 | H28: of:=SUM([.A28:.G28]) -> 800
A29: Miscellaneous | C29: 1000 | H29: of:=SUM([.A29:.G29]) -> 1000 | I29: of:=[.H29]/[.H$5] -> 0.00200152144670517
A30: Employees | C30: of:=SUM([.C31:.C32]) -> 68740.5405405405 | H30: of:=SUM([.A30:.G30]) -> 68740.5405405405 | I30: of:=[.H30]/[.H$5] -> 0.137585666149998
B31: Employees | C31: of:=(4*269000/USDCZK) -> 58162.1621621622 | H31: of:=SUM([.A31:.G31]) -> 58162.1621621622
B32: + Employee | C32: of:=(4*33000+4900*[.C69])/USDCZK -> 10578.3783783784 | H32: of:=SUM([.A32:.G32]) -> 10578.3783783784
A33: Taxes (employees+institute) | C33: of:=[.C30]/0.76*(1.34-0.76) -> 52459.8862019915 | H33: of:=SUM([.A33:.G33]) -> 52459.8862019915 | I33: of:=[.H33]/[.H$5] -> 0.104999587324999
A34: Banking fees | C34: of:=SUM([.C35:.C36]) -> 1200 | H34: of:=SUM([.A34:.G34]) -> 1200 | I34: of:=[.H34]/[.H$5] -> 0.0024018257360462
B35: US | C35: 1000 | H35: of:=SUM([.A35:.G35]) -> 1000
B36: Czech | C36: 200 | H36: of:=SUM([.A36:.G36]) -> 200
A37: US administration cost | C37: of:=SUM([.C38:.C40]) -> 2833.33333333333 | D37: of:=SUM([.D38:.D40]) -> 31195.9459459459 | E37: of:=SUM([.E38:.E40]) -> 12060 | F37: of:=SUM([.F38:.F40]) -> 12060 | G37: of:=SUM([.G38:.G40]) -> 4020 | H37: of:=SUM([.C37:.G37]) -> 62169.2792792793 | I37: of:=[.H37]/[.H$5] -> 0.124433145803681
A38: University Administrative Fee | C38: of:=8500/3 -> 2833.33333333333 | H38: of:=SUM([.C38:.G38]) -> 2833.33333333333 | I38: of:=[.H38]/[.H$5] -> 0.00567097743233131
A39: College of Design Administration | D39: of:=[.D84]*0.1 -> 30150 | E39: of:=[.E84]*0.1 -> 12060 | F39: of:=[.F84]*0.1 -> 12060 | G39: of:=[.G84]*0.1 -> 4020 | H39: of:=SUM([.C39:.G39]) -> 58290 | I39: of:=[.H39]/[.H$5] -> 0.116668685128444
A40: Study abroad fee | D40: of:=[.D68]*[.D71] -> 1045.94594594595 | E40: of:=[.E66]*[.E69] -> 0 | F40: of:=[.F66]*[.F69] -> 0 | G40: of:=[.G66]*[.G69] -> 0 | H40: of:=SUM([.C40:.G40]) -> 1045.94594594595 | I40: of:=[.H40]/[.H$5] -> 0.00209348324290515
A41: Students | D41: of:=SUM([.D44:.D49])*[.D72] -> 75702.5675675676 | E41: of:=SUM([.E44:.E49])*[.E72] -> 30281.027027027 | F41: of:=SUM([.F44:.F49])*[.F72] -> 30281.027027027 | G41: of:=SUM([.G44:.G49])*[.G72] -> 10093.6756756757 | H41: of:=SUM([.C41:.G41]) -> 146358.297297297 | I41: of:=[.H41]/[.H$5] -> 0.292939270943792
A42: Program specific equip/suppl | D42: 2000 | E42: 5000 | F42: 0 | G42: 0 | H42: of:=SUM([.C42:.G42]) -> 7000 | I42: of:=[.H42]/[.H$5] -> 0.0140106501269362
A43: per student costs | D43: of:=SUM([.D44:.D49]) -> 2523.41891891892 | E43: of:=SUM([.E44:.E49]) -> 2523.41891891892 | F43: of:=SUM([.F44:.F49]) -> 2523.41891891892 | G43: of:=SUM([.G44:.G49]) -> 2523.41891891892 | H43: of:=SUMPRODUCT([.D43:.G43];[.D$72:.G$72]) -> 146358.297297297
B44: Other student expenses * | D44: 80 | E44: of:=[.$D44] -> 80 | F44: of:=[.$D44] -> 80 | G44: of:=[.$D44] -> 80 | H44: of:=SUMPRODUCT([.D44:.G44];[.D$72:.G$72]) -> 4640 | I44: of:=[.H44]/[.H$5] -> 0.00928705951271199
B45: Housing * | D45: of:=[.D68]*[.D71] -> 1045.94594594595 | E45: of:=[.E68]*[.E71] -> 1045.94594594595 | F45: of:=[.F68]*[.F71] -> 1045.94594594595 | G45: of:=[.G68]*[.G71] -> 1045.94594594595 | H45: of:=SUMPRODUCT([.D45:.G45];[.D$72:.G$72]) -> 60664.8648648649 | I45: of:=[.H45]/[.H$5] -> 0.121422028088498
B46: Orientation * | D46: 25 | E46: of:=[.$D46] -> 25 | F46: of:=[.$D46] -> 25 | G46: of:=[.$D46] -> 25 | H46: of:=SUMPRODUCT([.D46:.G46];[.D$72:.G$72]) -> 1450 | I46: of:=[.H46]/[.H$5] -> 0.0029022060977225
B47: Travel pass * | D47: of:=IF([.D68]<30;550+240;IF([.D68]<60;1100+240;1480+240))/USDCZK -> 92.972972972973 | E47: of:=IF([.E68]<30;550+240;IF([.E68]<60;1100+240;1480+240))/USDCZK -> 92.972972972973 | F47: of:=IF([.F68]<30;550+240;IF([.F68]<60;1100+240;1480+240))/USDCZK -> 92.972972972973 | G47: of:=IF([.G68]<30;550+240;IF([.G68]<60;1100+240;1480+240))/USDCZK -> 92.972972972973 | H47: of:=SUMPRODUCT([.D47:.G47];[.D$72:.G$72]) -> 5392.43243243243 | I47: of:=[.H47]/[.H$5] -> 0.010793069163422
B48: Culture & Excursions * | D48: of:=66*[.D69]+300 -> 1158 | E48: of:=66*[.E69]+300 -> 1158 | F48: of:=66*[.F69]+300 -> 1158 | G48: of:=66*[.G69]+300 -> 1158 | H48: of:=SUMPRODUCT([.D48:.G48];[.D$72:.G$72]) -> 67164 | I48: of:=[.H48]/[.H$5] -> 0.134430186446506
B49: Health Insurance * | D49: of:=[.$C$76]*[.D68] -> 121.5 | E49: of:=[.$C$76]*[.E68] -> 121.5 | F49: of:=[.$C$76]*[.F68] -> 121.5 | G49: of:=[.$C$76]*[.G68] -> 121.5 | H49: of:=SUMPRODUCT([.D49:.G49];[.D$72:.G$72]) -> 7047 | I49: of:=[.H49]/[.H$5] -> 0.0141047216349313
A50: Faculty | D50: of:=[.D51]+[.D57] -> 33212.4736842105 | E50: of:=[.E51]+[.E57] -> 18133 | F50: of:=[.F51]+[.F57] -> 10316 | G50: of:=[.G51]+[.G57] -> 300 | H50: of:=SUM([.C50:.G50]) -> 61961.4736842105 | I50: of:=[.H50]/[.H$5] -> 0.124017218448405
A51: Czech | D51: of:=SUM([.D52:.D56]) -> 18079.4736842105 | E51: of:=SUM([.E52:.E56]) -> 6000 | F51: of:=SUM([.F52:.F56]) -> 10316 | G51: of:=SUM([.G52:.G56]) -> 300 | H51: of:=SUM([.C51:.G51]) -> 34695.4736842105 | I51: of:=[.H51]/[.H$5] -> 0.0694437346825422
B52: Salaries | D52: 9000 | E52: 0 | F52: 6000 | G52: 0 | H52: of:=SUM([.C52:.G52]) -> 15000 | I52: of:=[.H52]/[.H$5] -> 0.0300228217005776
B53: Other | D53: of:=2*([.D63]) -> 2316 | E53: of:=0*([.E63]) -> 0 | F53: of:=2*([.F63]) -> 2316 | G53: 300 | H53: of:=SUM([.C53:.G53]) -> 4932 | I53: of:=[.H53]/[.H$5] -> 0.0098715037751499
A54: Guests
B55: Salaries | D55: of:=2500/19*25 -> 3289.47368421053 | E55: 6000 | F55: 2000 | G55: 0 | I55: of:=[.H55]/[.H$5] -> 0
B56: Other | D56: of:=3*([.D63]) -> 3474 | E56: of:=0*([.E63]) -> 0 | F56: of:=0*([.F63]) -> 0 | G56: of:=0*([.G63]) -> 0 | I56: of:=[.H56]/[.H$5] -> 0
A57: US | D57: of:=[.D73]*[.D59]+[.D58] -> 15133 | E57: of:=[.E73]*[.E59]+[.E58] -> 12133 | F57: of:=[.F73]*[.F59]+[.F58] -> 0 | G57: of:=[.G73]*[.G59]+[.G58] -> 0 | H57: of:=SUM([.C57:.G57]) -> 27266 | I57: of:=[.H57]/[.H$5] -> 0.0545734837658632
B58: Workshop total | D58: 3000 | H58: of:=SUM([.C58:.G58]) -> 3000
A59: per faculty | D59: of:=SUM([.D60:.D65]) -> 12133 | E59: of:=SUM([.E60:.E65]) -> 12133 | F59: of:=SUM([.F60:.F65]) -> 12133 | G59: of:=SUM([.G60:.G65]) -> 9133 | H59: of:=SUMPRODUCT([.D59:.G59];[.D$73:.G$73]) -> 24266 | I59: of:=[.H59]/[.H$5] -> 0.0485689194257477
B60: Salaries + benefit ** | D60: 6000 | E60: 6000 | F60: 6000 | G60: 3000 | H60: of:=SUMPRODUCT([.D60:.G60];[.D$73:.G$73]) -> 12000 | I60: of:=[.H60]/[.H$5] -> 0.024018257360462
B61: Travel** | D61: of:=1600+[.D75] -> 1600 | E61: of:=1600+[.E76] -> 1600 | F61: of:=1600+[.F75] -> 1600 | G61: of:=1600+[.G76] -> 1600 | H61: of:=SUMPRODUCT([.D61:.G61];[.D$73:.G$73]) -> 3200 | I61: of:=[.H61]/[.H$5] -> 0.00640486862945655
B62: Perdiem** | D62: of:=37.5*[.D68] -> 3375 | E62: of:=37.5*[.E68] -> 3375 | F62: of:=37.5*[.F68] -> 3375 | G62: of:=37.5*[.G68] -> 3375 | H62: of:=SUMPRODUCT([.D62:.G62];[.D$73:.G$73]) -> 6750 | I62: of:=[.H62]/[.H$5] -> 0.0135102697652599
B63: Culture & Excursions ** | D63: of:=[.D48] -> 1158 | E63: of:=[.E48] -> 1158 | F63: of:=[.F48] -> 1158 | G63: of:=[.G48] -> 1158 | H63: of:=SUMPRODUCT([.D63:.G63];[.D$73:.G$73]) -> 2316 | I63: of:=[.H63]/[.H$5] -> 0.00463552367056917
B64: Housing** | D64: of:=[.D68]*[.$D$76] -> 0 | E64: of:=[.E68]*[.$D$76] -> 0 | F64: of:=[.F68]*[.$D$76] -> 0 | G64: of:=[.G68]*[.$D$76] -> 0 | H64: of:=SUMPRODUCT([.D64:.G64];[.D$73:.G$73]) -> 0 | I64: of:=[.H64]/[.H$5] -> 0
B65: Health insurance** | D65: of:=[.$D$78]*[.D68] -> 0 | E65: of:=[.$D$78]*[.E68] -> 0 | F65: of:=[.$D$78]*[.F68] -> 0 | G65: of:=[.$D$78]*[.G68] -> 0 | H65: of:=SUMPRODUCT([.D65:.G65];[.D$73:.G$73]) -> 0 | I65: of:=[.H65]/[.H$5] -> 0
A67: Other info
A68: Length (days) | C68: 90 | D68: of:=[.C68] -> 90 | E68: of:=[.D68] -> 90 | F68: of:=[.E68] -> 90 | G68: of:=[.F68] -> 90
A69: Length (weeks) | C69: of:=ROUND([.C68]/7;0) -> 13 | D69: of:=ROUND([.D68]/7;0) -> 13 | E69: of:=ROUND([.E68]/7;0) -> 13 | F69: of:=ROUND([.F68]/7;0) -> 13 | G69: of:=ROUND([.G68]/7;0) -> 13
A70: Study abroad fee | C70: 400 | D70: of:=[.C70] -> 400 | E70: of:=[.D70] -> 400 | F70: of:=[.E70] -> 400 | G70: of:=[.F70] -> 400
A71: Housing cost / day / student | C71: of:=ACCOMBOTIC/USDCZK -> 11.6216216216216 | D71: of:=[.C71] -> 11.6216216216216 | E71: of:=[.D71] -> 11.6216216216216 | F71: of:=[.E71] -> 11.6216216216216 | G71: of:=[.F71] -> 11.6216216216216
A72: No. of students | D72: 30 | E72: 12 | F72: 12 | G72: 4 | H72: of:=SUM([.D72:.G72]) -> 58
A73: No. US of faculty | D73: 1 | E73: 1 | F73: 0 | G73: 0
A74: Travel pass cost / person | D74: of:=IF([.D68]<30;670+10;IF([.D68]<60;2*670+10;3*670+10))/USDCZK -> 109.189189189189 | E74: of:=IF([.E68]<30;670+10;IF([.E68]<60;2*670+10;3*670+10))/USDCZK -> 109.189189189189 | F74: of:=IF([.F68]<30;670+10;IF([.F68]<60;2*670+10;3*670+10))/USDCZK -> 109.189189189189 | G74: of:=IF([.G68]<30;670+10;IF([.G68]<60;2*670+10;3*670+10))/USDCZK -> 109.189189189189
A75: Housing cost / day / faculty | C75: of:=[$'Summer 2014'.C75] -> 48.6486486486487
A76: Health insurance | C76: 1.35
A77: Health insurance / faculty | C77: 3
A79: Fall budget 2014 | C79: INCOME
C81: Common | D81: of:=[.D3] -> ARC | E81: of:=[.E3] -> LAR | F81: of:=[.F3] -> MC | G81: of:=[.G3] -> GEP | H81: TOTAL
A82: TOTAL | C82: of:=SUM([.C84:.C85]) -> 0 | D82: of:=SUM([.D84:.D85]) -> 301500 | E82: of:=SUM([.E84:.E85]) -> 120600 | F82: of:=SUM([.F84:.F85]) -> 120600 | G82: of:=SUM([.G84:.G85]) -> 40200 | H82: of:=SUM([.C82:.G82]) -> 582900
A83: Students income per student | D83: of:=9650+400 -> 10050 | E83: of:=9650+400 -> 10050 | F83: of:=9650+400 -> 10050 | G83: of:=9650+400 -> 10050
A84: Students income - total | C84: of:=[.C83]*[.C72] -> 0 | D84: of:=[.D83]*[.D72] -> 301500 | E84: of:=[.E83]*[.E72] -> 120600 | F84: of:=[.F83]*[.F72] -> 120600 | G84: of:=[.G83]*[.G72] -> 40200 | H84: of:=SUM([.C84:.G84]) -> 582900
A85: Gifts | H85: of:=SUM([.C85:.G85]) -> 0
A87: * per student cost
A88: **per faculty cost

Sheet: Spring 2015
A1: Spring budget 2015 | C1: EXPENSES | H1: Balance | I1: of:=[.H82]-[.H5] -> 65673.5882724833
H2: of:=IF([.H5]=([.H9]+[.H37]+[.H41]+[.H50]);"kontrola ok";"kontrolní součet nesedí") -> kontrola ok
C3: Common | D3: UX | E3: FCD | F3: GEP | G3: DP | H3: TOTAL | I3: %
A4: BALANCE | D4: of:=[.D6]-[.D5] -> -7500.76884779494 | E4: of:=[.E6]-[.E5] -> 13243.210131184 | F4: of:=[.F6]-[.F5] -> 39166.5689900428 | G4: of:=[.G6]-[.G5] -> 20764.5779990519
A5: TOTAL COST | C5: of:=[.C9]+[.C37]+[.C41]+[.C50] -> 231964.210526315 | D5: of:=[.D9]+[.D37]+[.D41]+[.D50] -> 97950.7688477949 | E5: of:=[.E9]+[.E37]+[.E41]+[.E50] -> 177706.789868816 | F5: of:=[.F9]+[.F37]+[.F41]+[.F50] -> 161833.431009957 | G5: of:=[.G9]+[.G37]+[.G41]+[.G50] -> 140035.422000948 | H5: of:=SUM([.D5:.G5]) -> 577526.411727516 | I5: of:=[.H5]/[.H$5] -> 1
A6: TOTAL REVENUE | D6: of:=[.D82] -> 90450 | E6: of:=[.E82] -> 190950 | F6: of:=[.F82] -> 201000 | G6: of:=[.G82] -> 160800 | H6: of:=SUM([.D6:.G6]) -> 643200 | I6: of:=[.H6]/[.H$5] -> 1.11371529845023
B7: Size | D7: 1 | E7: 1 | F7: 1 | G7: 1 | H7: of:=SUM([.D7:.G7]) -> 4
B8: Percent for fixed exp. | D8: of:=[.D7]/[.$H$7] -> 0.25 | E8: of:=[.E7]/[.$H$7] -> 0.25 | F8: of:=[.F7]/[.$H$7] -> 0.25 | G8: of:=[.G7]/[.$H$7] -> 0.25
A9: Fixed costs | C9: of:=[.C10]+[.C11]+[.C16]+[.C17]+[.C20]+[.C21]+[.C29]+[.C30]+[.C33]+[.C34] -> 229130.877192982 | D9: of:=[.$C5]*[.D$8] -> 57991.0526315788 | E9: of:=[.$C5]*[.E$8] -> 57991.0526315788 | F9: of:=[.$C5]*[.F$8] -> 57991.0526315788 | G9: of:=[.$C5]*[.G$8] -> 57991.0526315788 | H9: of:=[.C9] -> 229130.877192982 | I9: of:=[.H9]/[.H$5] -> 0.396745278726903
A10: Rent | C10: of:=11400*12/3 -> 45600 | H10: of:=SUM([.A10:.G10]) -> 45600 | I10: of:=[.H10]/[.H$5] -> 0.0789574278752027 | K10: to budget | L10: name | M10: course | N10: paid from | P10: HPC
A11: Utilities | C11: of:=SUM([.C12:.C15]) -> 8556.75675675676 | H11: of:=SUM([.A11:.G11]) -> 8556.75675675676 | I11: of:=[.H11]/[.H$5] -> 0.0148162172032297 | K11: 3200 | L11: Pavla | M11: GEP | N11: CZ | O11: of:=[.M11]&[.N11] -> GEPCZ
B12: Internet +fixed phone | C12: of:=1000+4*5000/USDCZK+500 -> 2581.08108108108 | H12: of:=SUM([.A12:.G12]) -> 2581.08108108108 | K12: 3000 | L12: Jablonská | M12: GEP | N12: CZ | O12: of:=[.M12]&[.N12] -> GEPCZ | P12: 3000
B13: Mobile phone | C13: 1500 | H13: of:=SUM([.A13:.G13]) -> 1500 | K13: 6000 | L13: Hellebrandová | M13: GEP | N13: CZ | O13: of:=[.M13]&[.N13] -> GEPCZ | P13: 3000
B14: Electricity | C14: of:=6000/3*1.2 -> 2400 | H14: of:=SUM([.A14:.G14]) -> 2400 | K14: 3000 | L14: Lenka D. | M14: GEP | N14: CZ | O14: of:=[.M14]&[.N14] -> GEPCZ
B15: Gas | C15: of:=96000*1.2/USDCZK/3 -> 2075.67567567568 | H15: of:=SUM([.A15:.G15]) -> 2075.67567567568 | K15: 3800 | L15: Vojtěchovský | M15: DP | N15: CZ | O15: of:=[.M15]&[.N15] -> DPCZ | P15: 800
A16: Library | C16: of:=8200/3*1.2 -> 3280 | H16: of:=SUM([.A16:.G16]) -> 3280 | I16: of:=[.H16]/[.H$5] -> 0.005679393934883 | K16: 3000 | L16: Matěj Král | M16: GEP | N16: CZ | O16: of:=[.M16]&[.N16] -> GEPCZ
A17: Office supplies | C17: of:=SUM([.C18:.C19]) -> 12600 | H17: of:=SUM([.A17:.G17]) -> 12600 | I17: of:=[.H17]/[.H$5] -> 0.0218171840181481 | K17: 3200 | L17: Beneš | M17: DP | N17: CZ | O17: of:=[.M17]&[.N17] -> DPCZ | P17: 200
B18: Other supplies | C18: of:=34200/3 -> 11400 | H18: of:=SUM([.A18:.G18]) -> 11400 | K18: 3000 | L18: Břečka | M18: UX | N18: CZ | O18: of:=[.M18]&[.N18] -> UXCZ
B19: Cleaning supplies | C19: 1200 | H19: of:=SUM([.A19:.G19]) -> 1200 | K19: 2200 | L19: Paseková | M19: GEP | N19: CZ | O19: of:=[.M19]&[.N19] -> GEPCZ | P19: 2200
A20: Director travel | C20: of:=8000/3 -> 2666.66666666667 | H20: of:=SUM([.A20:.G20]) -> 2666.66666666667 | I20: of:=[.H20]/[.H$5] -> 0.00461739344299431 | K20: 3000 | L20: Votápková | M20: GEP | N20: CZ | O20: of:=[.M20]&[.N20] -> GEPCZ
A21: Services | C21: of:=SUM([.C22:.C28]) -> 33027.027027027 | H21: of:=SUM([.A21:.G21]) -> 33027.027027027 | I21: of:=[.H21]/[.H$5] -> 0.0571870417635714 | K21: 11000 | L21: Tučna | M21: FCD | N21: CZ | O21: of:=[.M21]&[.N21] -> FCDCZ
B22: Bookkeeper | C22: of:=4*100000/USDCZK -> 21621.6216216216 | H22: of:=SUM([.A22:.G22]) -> 21621.6216216216 | K22: 11000 | L22: Tachezyová | M22: FCD | N22: CZ | O22: of:=[.M22]&[.N22] -> FCDCZ
B23: IT Services | C23: of:=60000/USDCZK -> 3243.24324324324 | H23: of:=SUM([.A23:.G23]) -> 3243.24324324324 | K23: 3200 | L23: Dalibor | M23: GEP | N23: CZ | O23: of:=[.M23]&[.N23] -> GEPCZ
B24: Repairs | C24: 2500 | H24: of:=SUM([.A24:.G24]) -> 2500 | K24: 1700 | L24: Maděra | M24: GEP | N24: CZ | O24: of:=[.M24]&[.N24] -> GEPCZ
B25: Transportation | C25: 1000 | H25: of:=SUM([.A25:.G25]) -> 1000 | K25: 3000 | L25: Ibl | M25: UX | N25: CZ | O25: of:=[.M25]&[.N25] -> UXCZ | P25: ..
B26: Restaurant | C26: 700 | H26: of:=SUM([.A26:.G26]) -> 700 | K26: 1500 | L26: Černovský | M26: GEP | N26: CZ | O26: of:=[.M26]&[.N26] -> GEPCZ | P26: ..
B27: Security company | C27: of:=(150/USDCZK)*30*[.C69] -> 3162.16216216216 | H27: of:=SUM([.A27:.G27]) -> 3162.16216216216 | O27: of:=[.M27]&[.N27] -> 
B28: Other services | C28: 800 | H28: of:=SUM([.A28:.G28]) -> 800 | K28: 666.666666666667 | L28: Vano | M28: DP | N28: CZ | O28: of:=[.M28]&[.N28] -> DPCZ
A29: Miscellaneous | C29: 1000 | H29: of:=SUM([.A29:.G29]) -> 1000 | I29: of:=[.H29]/[.H$5] -> 0.00173152254112287 | K29: 888.888888888889 | L29: Pavla Dydovičová | M29: FCD | N29: CZ | O29: of:=[.M29]&[.N29] -> FCDCZ
A30: Employees | C30: of:=SUM([.C31:.C32]) -> 68740.5405405405 | H30: of:=SUM([.A30:.G30]) -> 68740.5405405405 | I30: of:=[.H30]/[.H$5] -> 0.119025795434916 | K30: 888.888888888889 | L30: Bára Kafková | M30: FCD | N30: CZ | O30: of:=[.M30]&[.N30] -> FCDCZ
B31: Employees | C31: of:=(4*269000/USDCZK) -> 58162.1621621622 | H31: of:=SUM([.A31:.G31]) -> 58162.1621621622 | O31: of:=[.M31]&[.N31] -> 
B32: + additional help | C32: of:=(4*33000+4900*[.C69])/USDCZK -> 10578.3783783784 | H32: of:=SUM([.A32:.G32]) -> 10578.3783783784 | K32: 15270 | L32: Anderson | M32: FCD | N32: US | O32: of:=[.M32]&[.N32] -> FCDUS
A33: Taxes (employees+institute) | C33: of:=[.C30]/0.76*(1.34-0.76) -> 52459.8862019915 | H33: of:=SUM([.A33:.G33]) -> 52459.8862019915 | I33: of:=[.H33]/[.H$5] -> 0.0908354754634887 | K33: 3200 | L33: Moskal | M33: FCD | N33: US | O33: of:=[.M33]&[.N33] -> FCDUS
A34: Banking fees | C34: of:=SUM([.C35:.C36]) -> 1200 | H34: of:=SUM([.A34:.G34]) -> 1200 | I34: of:=[.H34]/[.H$5] -> 0.00207782704934744 | K34: 3200 | L34: Rosenblum | M34: DP | N34: US | O34: of:=[.M34]&[.N34] -> DPUS
B35: US | C35: 1000 | H35: of:=SUM([.A35:.G35]) -> 1000
B36: Czech | C36: 200 | H36: of:=SUM([.A36:.G36]) -> 200
A37: US administration cost | C37: of:=SUM([.C38:.C40]) -> 2833.33333333333 | D37: of:=SUM([.D38:.D40]) -> 10090.9459459459 | E37: of:=SUM([.E38:.E40]) -> 19095 | F37: of:=SUM([.F38:.F40]) -> 20100 | G37: of:=SUM([.G38:.G40]) -> 16080 | H37: of:=SUM([.C37:.G37]) -> 68199.2792792793 | I37: of:=[.H37]/[.H$5] -> 0.118088589360406 | K37: of:=SUMIF([.N$11:.N$30];"CZ";[.K$11:.K$30]) -> 67244.4444444444 | L37: SUM CZ
A38: University Administrative Fee | C38: of:=8500/3 -> 2833.33333333333 | H38: of:=SUM([.C38:.G38]) -> 2833.33333333333 | I38: of:=[.H38]/[.H$5] -> 0.00490598053318145 | K38: of:=SUM([.K32:.K34]) -> 21670 | L38: SUM EN
A39: College of Design Administration | D39: of:=[.D84]*0.1 -> 9045 | E39: of:=[.E84]*0.1 -> 19095 | F39: of:=[.F84]*0.1 -> 20100 | G39: of:=[.G84]*0.1 -> 16080 | H39: of:=SUM([.C39:.G39]) -> 64320 | I39: of:=[.H39]/[.H$5] -> 0.111371529845023 | K39: of:=SUM([.K37:.K38]) -> 88914.4444444444 | L39: SUM
A40: Study abroad fee | D40: of:=[.D68]*[.D71] -> 1045.94594594595 | E40: of:=[.E66]*[.E69] -> 0 | F40: of:=[.F66]*[.F69] -> 0 | G40: of:=[.G66]*[.G69] -> 0 | H40: of:=SUM([.C40:.G40]) -> 1045.94594594595 | I40: of:=[.H40]/[.H$5] -> 0.00181107898220149
A41: Students | D41: of:=SUM([.D44:.D49])*[.D72] -> 22710.7702702703 | E41: of:=SUM([.E44:.E49])*[.E72] -> 47944.9594594595 | F41: of:=SUM([.F44:.F49])*[.F72] -> 50468.3783783784 | G41: of:=SUM([.G44:.G49])*[.G72] -> 40374.7027027027 | H41: of:=SUM([.C41:.G41]) -> 161498.810810811 | I41: of:=[.H41]/[.H$5] -> 0.279638831283456 | K41: of:=SUMIF([.O$11:.O$35];[.L41]&[.M41];[.K$11:.K$35]) -> 6000 | L41: UX | M41: CZ
A42: Program specific equip/suppl | D42: 2000 | E42: 5000 | F42: 0 | G42: 6000 | H42: of:=SUM([.C42:.G42]) -> 13000 | I42: of:=[.H42]/[.H$5] -> 0.0225097930345972 | K42: of:=SUMIF([.O$11:.O$35];[.L42]&[.M42];[.K$11:.K$35]) -> 23777.7777777778 | L42: FCD | M42: CZ
A43: per student costs | D43: of:=SUM([.D44:.D49]) -> 2523.41891891892 | E43: of:=SUM([.E44:.E49]) -> 2523.41891891892 | F43: of:=SUM([.F44:.F49]) -> 2523.41891891892 | G43: of:=SUM([.G44:.G49]) -> 2523.41891891892 | H43: of:=[.D43]*[.D$72]+[.E43]*[.E$72]+[.F43]*[.F$72]+[.G43]*[.G$72] -> 161498.810810811 | K43: of:=SUMIF([.O$11:.O$35];[.L43]&[.M43];[.K$11:.K$35]) -> 29800 | L43: GEP | M43: CZ
B44: Other student expenses * | D44: 80 | E44: of:=[.$D44] -> 80 | F44: of:=[.$D44] -> 80 | G44: of:=[.$D44] -> 80 | H44: of:=[.D44]*[.D$72]+[.E44]*[.E$72]+[.F44]*[.F$72]+[.G44]*[.G$72] -> 5120 | I44: of:=[.H44]/[.H$5] -> 0.00886539541054907 | K44: of:=SUMIF([.O$11:.O$35];[.L44]&[.M44];[.K$11:.K$35]) -> 7666.66666666667 | L44: DP | M44: CZ
B45: Housing * | D45: of:=[.D68]*[.D71] -> 1045.94594594595 | E45: of:=[.E68]*[.E71] -> 1045.94594594595 | F45: of:=[.F68]*[.F71] -> 1045.94594594595 | G45: of:=[.G68]*[.G71] -> 1045.94594594595 | H45: of:=[.D45]*[.D$72]+[.E45]*[.E$72]+[.F45]*[.F$72]+[.G45]*[.G$72] -> 66940.5405405405 | I45: of:=[.H45]/[.H$5] -> 0.115909054860895 | K45: of:=SUMIF([.O$11:.O$35];[.L45]&[.M45];[.K$11:.K$35]) -> 0 | L45: UX | M45: US
B46: Orientation * | D46: 25 | E46: of:=[.$D46] -> 25 | F46: of:=[.$D46] -> 25 | G46: of:=[.$D46] -> 25 | H46: of:=[.D46]*[.D$72]+[.E46]*[.E$72]+[.F46]*[.F$72]+[.G46]*[.G$72] -> 1600 | I46: of:=[.H46]/[.H$5] -> 0.00277043606579658 | K46: of:=SUMIF([.O$11:.O$35];[.L46]&[.M46];[.K$11:.K$35]) -> 18470 | L46: FCD | M46: US
B47: Travel pass * | D47: of:=IF([.D68]<30;550+240;IF([.D68]<60;1100+240;1480+240))/USDCZK -> 92.972972972973 | E47: of:=IF([.E68]<30;550+240;IF([.E68]<60;1100+240;1480+240))/USDCZK -> 92.972972972973 | F47: of:=IF([.F68]<30;550+240;IF([.F68]<60;1100+240;1480+240))/USDCZK -> 92.972972972973 | G47: of:=IF([.G68]<30;550+240;IF([.G68]<60;1100+240;1480+240))/USDCZK -> 92.972972972973 | H47: of:=[.D47]*[.D$72]+[.E47]*[.E$72]+[.F47]*[.F$72]+[.G47]*[.G$72] -> 5950.27027027027 | I47: of:=[.H47]/[.H$5] -> 0.0103030270987462 | K47: of:=SUMIF([.O$11:.O$35];[.L47]&[.M47];[.K$11:.K$35]) -> 0 | L47: GEP | M47: US
B48: Culture & Excursions * | D48: of:=66*[.D69]+300 -> 1158 | E48: of:=66*[.E69]+300 -> 1158 | F48: of:=66*[.F69]+300 -> 1158 | G48: of:=66*[.G69]+300 -> 1158 | H48: of:=[.D48]*[.D$72]+[.E48]*[.E$72]+[.F48]*[.F$72]+[.G48]*[.G$72] -> 74112 | I48: of:=[.H48]/[.H$5] -> 0.128326598567698 | K48: of:=SUMIF([.O$11:.O$35];[.L48]&[.M48];[.K$11:.K$35]) -> 3200 | L48: DP | M48: US
B49: Health Insurance * | D49: of:=[.$C$76]*[.D68] -> 121.5 | E49: of:=[.$C$76]*[.E68] -> 121.5 | F49: of:=[.$C$76]*[.F68] -> 121.5 | G49: of:=[.$C$76]*[.G68] -> 121.5 | H49: of:=[.D49]*[.D$72]+[.E49]*[.E$72]+[.F49]*[.F$72]+[.G49]*[.G$72] -> 7776 | I49: of:=[.H49]/[.H$5] -> 0.0134643192797714
A50: Faculty | D50: of:=[.D51]+[.D57] -> 7158 | E50: of:=[.E51]+[.E57] -> 52675.7777777778 | F50: of:=[.F51]+[.F57] -> 33274 | G50: of:=[.G51]+[.G57] -> 25589.6666666667 | H50: of:=SUM([.C50:.G50]) -> 118697.444444444 | I50: of:=[.H50]/[.H$5] -> 0.205527300629235
A51: Czech | D51: of:=SUM([.D52:.D56]) -> 7158 | E51: of:=SUM([.E52:.E56]) -> 28409.7777777778 | F51: of:=SUM([.F52:.F56]) -> 33274 | G51: of:=SUM([.G52:.G56]) -> 13456.6666666667 | H51: of:=SUM([.C51:.G51]) -> 82298.4444444445 | I51: of:=[.H51]/[.H$5] -> 0.142501611654904
B52: Salaries | D52: of:=[.K41] -> 6000 | E52: of:=[.K42] -> 23777.7777777778 | F52: of:=[.K43] -> 29800 | G52: of:=[.K44] -> 7666.66666666667 | H52: of:=SUM([.C52:.G52]) -> 67244.4444444444 | I52: of:=[.H52]/[.H$5] -> 0.11643527132084
B53: Other | D53: of:=1*([.D$63]) -> 1158 | E53: of:=4*([.E$63]) -> 4632 | F53: of:=3*([.F$63]) -> 3474 | G53: of:=3*([.G$63]) -> 3474 | H53: of:=SUM([.C53:.G53]) -> 12738 | I53: of:=[.H53]/[.H$5] -> 0.0220561341288231
A54: Guests
B55: Salaries | D55: 0 | E55: 0 | F55: 0 | G55: 0 | I55: of:=[.H55]/[.H$5] -> 0
B56: Other | D56: of:=0*([.D$63]) -> 0 | E56: of:=0*([.E$63]) -> 0 | F56: of:=0*([.F$63]) -> 0 | G56: of:=2*([.G$63]) -> 2316 | I56: of:=[.H56]/[.H$5] -> 0
A57: US | D57: of:=[.D73]*[.D59]+[.D58] -> 0 | E57: of:=[.E73]*[.E59]+[.E58] -> 24266 | F57: of:=[.F73]*[.F59]+[.F58] -> 0 | G57: of:=[.G73]*[.G59]+[.G58] -> 12133 | H57: of:=SUM([.C57:.G57]) -> 36399 | I57: of:=[.H57]/[.H$5] -> 0.0630256889743312
B58: Workshop total | H58: of:=SUM([.C58:.G58]) -> 0
A59: per faculty | D59: of:=SUM([.D60:.D65]) -> 12133 | E59: of:=SUM([.E60:.E65]) -> 12133 | F59: of:=SUM([.F60:.F65]) -> 9133 | G59: of:=SUM([.G60:.G65]) -> 12133 | H59: of:=[.D59]*[.D$73]+[.E59]*[.E$73]+[.F59]*[.F$73]+[.G59]*[.G$73] -> 36399 | I59: of:=[.H59]/[.H$5] -> 0.0630256889743312
B60: Salaries + benefit ** | D60: 6000 | E60: 6000 | F60: 3000 | G60: 6000 | H60: of:=[.D60]*[.D$73]+[.E60]*[.E$73]+[.F60]*[.F$73]+[.G60]*[.G$73] -> 18000 | I60: of:=[.H60]/[.H$5] -> 0.0311674057402116
B61: Travel** | D61: of:=1600+[.D75] -> 1600 | E61: of:=1600+[.E76] -> 1600 | F61: of:=1600+[.F75] -> 1600 | G61: of:=1600+[.G76] -> 1600 | H61: of:=[.D61]*[.D$73]+[.E61]*[.E$73]+[.F61]*[.F$73]+[.G61]*[.G$73] -> 4800 | I61: of:=[.H61]/[.H$5] -> 0.00831130819738976
B62: Perdiem** | D62: of:=37.5*[.D68] -> 3375 | E62: of:=37.5*[.E68] -> 3375 | F62: of:=37.5*[.F68] -> 3375 | G62: of:=37.5*[.G68] -> 3375 | H62: of:=[.D62]*[.D$73]+[.E62]*[.E$73]+[.F62]*[.F$73]+[.G62]*[.G$73] -> 10125 | I62: of:=[.H62]/[.H$5] -> 0.017531665728869
B63: Culture & Excursions ** | D63: of:=[.D48] -> 1158 | E63: of:=[.E48] -> 1158 | F63: of:=[.F48] -> 1158 | G63: of:=[.G48] -> 1158 | H63: of:=[.D63]*[.D$73]+[.E63]*[.E$73]+[.F63]*[.F$73]+[.G63]*[.G$73] -> 3474 | I63: of:=[.H63]/[.H$5] -> 0.00601530930786084
B64: Housing** | D64: of:=[.D68]*[.$D$76] -> 0 | E64: of:=[.E68]*[.$D$76] -> 0 | F64: of:=[.F68]*[.$D$76] -> 0 | G64: of:=[.G68]*[.$D$76] -> 0 | H64: of:=[.D64]*[.D$73]+[.E64]*[.E$73]+[.F64]*[.F$73]+[.G64]*[.G$73] -> 0 | I64: of:=[.H64]/[.H$5] -> 0
B65: Health insurance** | D65: of:=[.$D$78]*[.D68] -> 0 | E65: of:=[.$D$78]*[.E68] -> 0 | F65: of:=[.$D$78]*[.F68] -> 0 | G65: of:=[.$D$78]*[.G68] -> 0 | H65: of:=[.D65]*[.D$73]+[.E65]*[.E$73]+[.F65]*[.F$73]+[.G65]*[.G$73] -> 0 | I65: of:=[.H65]/[.H$5] -> 0
A67: Other info
A68: Length (days) | C68: 90 | D68: of:=[.C68] -> 90 | E68: of:=[.D68] -> 90 | F68: of:=[.E68] -> 90 | G68: of:=[.F68] -> 90
A69: Length (weeks) | C69: of:=ROUND([.C68]/7;0) -> 13 | D69: of:=ROUND([.D68]/7;0) -> 13 | E69: of:=ROUND([.E68]/7;0) -> 13 | F69: of:=ROUND([.F68]/7;0) -> 13 | G69: of:=ROUND([.G68]/7;0) -> 13
A70: Study abroad fee | C70: 450 | D70: of:=[.C70] -> 450 | E70: of:=[.D70] -> 450 | F70: of:=[.E70] -> 450 | G70: of:=[.F70] -> 450
A71: Housing cost / day / student | C71: of:=ACCOMBOTIC/USDCZK -> 11.6216216216216 | D71: of:=[.C71] -> 11.6216216216216 | E71: of:=ACCOMBOTIC/USDCZK -> 11.6216216216216 | F71: of:=[.E71] -> 11.6216216216216 | G71: of:=ACCOMBOTIC/USDCZK -> 11.6216216216216
A72: No. of students | D72: 9 | E72: 19 | F72: 20 | G72: 16 | H72: of:=SUM([.D72:.G72]) -> 64
A73: No. US of faculty | D73: 0 | E73: 2 | F73: 0 | G73: 1
A74: Travel pass cost / person | D74: of:=IF([.D68]<30;670+10;IF([.D68]<60;2*670+10;3*670+10))/USDCZK -> 109.189189189189 | E74: of:=IF([.E68]<30;670+10;IF([.E68]<60;2*670+10;3*670+10))/USDCZK -> 109.189189189189 | F74: of:=IF([.F68]<30;670+10;IF([.F68]<60;2*670+10;3*670+10))/USDCZK -> 109.189189189189 | G74: of:=IF([.G68]<30;670+10;IF([.G68]<60;2*670+10;3*670+10))/USDCZK -> 109.189189189189
A75: Housing cost / day / faculty | C75: of:=[$'Fall 2014'.C75] -> 48.6486486486487
A76: Health insurance | C76: 1.35
A77: Health insurance / faculty | C77: 3
A79: of:=[.A1] -> Spring budget 2015 | C79: INCOME
C81: Common | D81: LAR | E81: FCD | H81: TOTAL
A82: TOTAL | C82: of:=SUM([.C84:.C85]) -> 0 | D82: of:=SUM([.D84:.D85]) -> 90450 | E82: of:=SUM([.E84:.E85]) -> 190950 | F82: of:=SUM([.F84:.F85]) -> 201000 | G82: of:=SUM([.G84:.G85]) -> 160800 | H82: of:=SUM([.C82:.G82]) -> 643200
A83: Students income per student | D83: of:=9650+400 -> 10050 | E83: of:=9650+400 -> 10050 | F83: of:=9650+400 -> 10050 | G83: of:=9650+400 -> 10050
A84: Students income - total | C84: of:=[.C83]*[.C72] -> 0 | D84: of:=[.D83]*[.D72] -> 90450 | E84: of:=[.E83]*[.E72] -> 190950 | F84: of:=[.F83]*[.F72] -> 201000 | G84: of:=[.G83]*[.G72] -> 160800 | H84: of:=SUM([.C84:.G84]) -> 643200
A85: Gifts | H85: of:=SUM([.C85:.G85]) -> 0
A87: * per student cost
A88: **per faculty cost

Sheet: 14B-15A
A1: 14B-15A Budget | C1: EXPENSES | F1: Balance | G1: of:=[.F71]-[.F5] -> 51682.4133080472
F2: of:=IF([.F5]=([.F7]+[.F35]+[.F39]+[.F48]);"kontrola ok";"kontrolní součet nesedí") -> kontrolní součet nesedí
C3: 14B | D3: 14C | E3: 15A | F3: TOTAL | G3: %
A4: BALANCE | C4: of:=[.C6]-[.C5] -> -97271.247510668 | D4: of:=[.D6]-[.D5] -> 83280.0725462309 | E4: of:=[.E6]-[.E5] -> 65673.5882724838
A5: TOTAL COST | C5: of:=[.C7]+[.C35]+[.C39]+[.C48] -> 534071.247510668 | D5: of:=[.D7]+[.D35]+[.D39]+[.D48] -> 499619.927453769 | E5: of:=[.E7]+[.E35]+[.E39]+[.E48] -> 577526.411727516 | F5: of:=SUM([.C5:.E5]) -> 1611217.58669195 | G5: of:=[.F5]/[.F$5] -> 1
A6: TOTAL REVENUE | C6: of:=[.C71] -> 436800 | D6: of:=[.D71] -> 582900 | E6: of:=[.E71] -> 643200 | F6: of:=SUM([.C6:.E6]) -> 1662900 | G6: of:=[.F6]/[.F$5] -> 1.03207661940567
A7: Fixed costs | C7: of:=[$'Summer 2014'.J9] -> 224159.184447605 | D7: of:=[$'Fall 2014'.H9] -> 229130.877192982 | E7: of:=[$'Spring 2015'.H9] -> 229130.877192982 | F7: of:=SUM([.C7:.E7]) -> 682420.938833571 | G7: of:=[.F7]/[.F$5] -> 0.423543625932406
A8: Rent | C8: of:=[$'Summer 2014'.J10] -> 45600 | D8: of:=[$'Fall 2014'.H10] -> 45600 | E8: of:=[$'Spring 2015'.H10] -> 45600 | F8: of:=SUM([.C8:.E8]) -> 136800 | G8: of:=[.F8]/[.F$5] -> 0.0849047336187962
A9: Utilities | C9: of:=[$'Summer 2014'.J11] -> 8556.75675675676 | D9: of:=[$'Fall 2014'.H11] -> 8556.75675675676 | E9: of:=[$'Spring 2015'.H11] -> 8556.75675675676 | F9: of:=SUM([.C9:.E9]) -> 25670.2702702703 | G9: of:=[.F9]/[.F$5] -> 0.0159322182691506
B10: Internet +fixed phone | C10: of:=[$'Summer 2014'.J12] -> 2581.08108108108 | D10: of:=[$'Fall 2014'.H12] -> 2581.08108108108 | E10: of:=[$'Spring 2015'.H12] -> 2581.08108108108 | F10: of:=SUM([.C10:.E10]) -> 7743.24324324324
B11: Mobile phone | C11: of:=[$'Summer 2014'.J13] -> 1500 | D11: of:=[$'Fall 2014'.H13] -> 1500 | E11: of:=[$'Spring 2015'.H13] -> 1500 | F11: of:=SUM([.C11:.E11]) -> 4500
B12: Electricity | C12: of:=[$'Summer 2014'.J14] -> 2400 | D12: of:=[$'Fall 2014'.H14] -> 2400 | E12: of:=[$'Spring 2015'.H14] -> 2400 | F12: of:=SUM([.C12:.E12]) -> 7200
B13: Gas | C13: of:=[$'Summer 2014'.J15] -> 2075.67567567568 | D13: of:=[$'Fall 2014'.H15] -> 2075.67567567568 | E13: of:=[$'Spring 2015'.H15] -> 2075.67567567568 | F13: of:=SUM([.C13:.E13]) -> 6227.02702702703
A14: Library | C14: of:=[$'Summer 2014'.J16] -> 3280 | D14: of:=[$'Fall 2014'.H16] -> 3280 | E14: of:=[$'Spring 2015'.H16] -> 3280 | F14: of:=SUM([.C14:.E14]) -> 9840 | G14: of:=[.F14]/[.F$5] -> 0.00610718259363271
A15: Office supplies | C15: of:=[$'Summer 2014'.J17] -> 12600 | D15: of:=[$'Fall 2014'.H17] -> 12600 | E15: of:=[$'Spring 2015'.H17] -> 12600 | F15: of:=SUM([.C15:.E15]) -> 37800 | G15: of:=[.F15]/[.F$5] -> 0.0234605184999305
B16: Other supplies | C16: of:=[$'Summer 2014'.J18] -> 11400 | D16: of:=[$'Fall 2014'.H18] -> 11400 | E16: of:=[$'Spring 2015'.H18] -> 11400 | F16: of:=SUM([.C16:.E16]) -> 34200
B17: Cleaning supplies | C17: of:=[$'Summer 2014'.J19] -> 1200 | D17: of:=[$'Fall 2014'.H19] -> 1200 | E17: of:=[$'Spring 2015'.H19] -> 1200 | F17: of:=SUM([.C17:.E17]) -> 3600
A18: Director travel | C18: of:=[$'Summer 2014'.J20] -> 2666.66666666667 | D18: of:=[$'Fall 2014'.H20] -> 2666.66666666667 | E18: of:=[$'Spring 2015'.H20] -> 2666.66666666667 | F18: of:=SUM([.C18:.E18]) -> 8000 | G18: of:=[.F18]/[.F$5] -> 0.0049651891005144
A19: Services | C19: of:=[$'Summer 2014'.J21] -> 31324.3243243243 | D19: of:=[$'Fall 2014'.H21] -> 33027.027027027 | E19: of:=[$'Spring 2015'.H21] -> 33027.027027027 | F19: of:=SUM([.C19:.E19]) -> 97378.3783783784 | G19: of:=[.F19]/[.F$5] -> 0.0604377578687615
B20: Bookkeeper | C20: of:=[$'Summer 2014'.J22] -> 21621.6216216216 | D20: of:=[$'Fall 2014'.H22] -> 21621.6216216216 | E20: of:=[$'Spring 2015'.H22] -> 21621.6216216216 | F20: of:=SUM([.C20:.E20]) -> 64864.8648648649
B21: IT Services | C21: of:=[$'Summer 2014'.J23] -> 3243.24324324324 | D21: of:=[$'Fall 2014'.H23] -> 3243.24324324324 | E21: of:=[$'Spring 2015'.H23] -> 3243.24324324324 | F21: of:=SUM([.C21:.E21]) -> 9729.72972972973
B22: Repairs | C22: of:=[$'Summer 2014'.J24] -> 2500 | D22: of:=[$'Fall 2014'.H24] -> 2500 | E22: of:=[$'Spring 2015'.H24] -> 2500 | F22: of:=SUM([.C22:.E22]) -> 7500
B23: Transportation | C23: of:=[$'Summer 2014'.J25] -> 1000 | D23: of:=[$'Fall 2014'.H25] -> 1000 | E23: of:=[$'Spring 2015'.H25] -> 1000 | F23: of:=SUM([.C23:.E23]) -> 3000
B24: Restaurant | C24: of:=[$'Summer 2014'.J26] -> 700 | D24: of:=[$'Fall 2014'.H26] -> 700 | E24: of:=[$'Spring 2015'.H26] -> 700 | F24: of:=SUM([.C24:.E24]) -> 2100
B25: Security company | C25: of:=[$'Summer 2014'.J27] -> 1459.45945945946 | D25: of:=[$'Fall 2014'.H27] -> 3162.16216216216 | E25: of:=[$'Spring 2015'.H27] -> 3162.16216216216 | F25: of:=SUM([.C25:.E25]) -> 7783.78378378379
B26: Other services | C26: of:=[$'Summer 2014'.J28] -> 800 | D26: of:=[$'Fall 2014'.H28] -> 800 | E26: of:=[$'Spring 2015'.H28] -> 800 | F26: of:=SUM([.C26:.E26]) -> 2400
A27: Miscellaneous | C27: of:=[$'Summer 2014'.J29] -> 1000 | D27: of:=[$'Fall 2014'.H29] -> 1000 | E27: of:=[$'Spring 2015'.H29] -> 1000 | F27: of:=SUM([.C27:.E27]) -> 3000 | G27: of:=[.F27]/[.F$5] -> 0.0018619459126929
A28: Employees | C28: of:=[$'Summer 2014'.J30] -> 66886.4864864865 | D28: of:=[$'Fall 2014'.H30] -> 68740.5405405405 | E28: of:=[$'Spring 2015'.H30] -> 68740.5405405405 | F28: of:=SUM([.C28:.E28]) -> 204367.567567568 | G28: of:=[.F28]/[.F$5] -> 0.126840452373141
B29: Employees | C29: of:=[$'Summer 2014'.J31] -> 58162.1621621622 | D29: of:=[$'Fall 2014'.H31] -> 58162.1621621622 | E29: of:=[$'Spring 2015'.H31] -> 58162.1621621622 | F29: of:=SUM([.C29:.E29]) -> 174486.486486486
B30: + Employee | C30: of:=[$'Summer 2014'.J32] -> 8724.32432432433 | D30: of:=[$'Fall 2014'.H32] -> 10578.3783783784 | E30: of:=[$'Spring 2015'.H32] -> 10578.3783783784 | F30: of:=SUM([.C30:.E30]) -> 29881.0810810811
A31: Taxes (employees+institute) | C31: of:=[$'Summer 2014'.J33] -> 51044.9502133713 | D31: of:=[$'Fall 2014'.H33] -> 52459.8862019915 | E31: of:=[$'Spring 2015'.H33] -> 52459.8862019915 | F31: of:=SUM([.C31:.E31]) -> 155964.722617354 | G31: of:=[.F31]/[.F$5] -> 0.0967992926005547
A32: Banking fees | C32: of:=[$'Summer 2014'.J34] -> 1200 | D32: of:=[$'Fall 2014'.H34] -> 1200 | E32: of:=[$'Spring 2015'.H34] -> 1200 | F32: of:=SUM([.C32:.E32]) -> 3600 | G32: of:=[.F32]/[.F$5] -> 0.00223433509523148
B33: US | C33: of:=[$'Summer 2014'.J35] -> 1000 | D33: of:=[$'Fall 2014'.H35] -> 1000 | E33: of:=[$'Spring 2015'.H35] -> 1000 | F33: of:=SUM([.C33:.E33]) -> 3000
B34: Czech | C34: of:=[$'Summer 2014'.J36] -> 200 | D34: of:=[$'Fall 2014'.H36] -> 200 | E34: of:=[$'Spring 2015'.H36] -> 200 | F34: of:=SUM([.C34:.E34]) -> 600
A35: US administration cost | C35: of:=[$'Summer 2014'.J37] -> 69913.3333333333 | D35: of:=[$'Fall 2014'.H37] -> 62169.2792792793 | E35: of:=[$'Spring 2015'.H37] -> 68199.2792792793 | F35: of:=SUM([.C35:.E35]) -> 200281.891891892 | G35: of:=[.F35]/[.F$5] -> 0.124304683331503
A36: University Administrative Fee | C36: of:=[$'Summer 2014'.J38] -> 2833.33333333333 | D36: of:=[$'Fall 2014'.H38] -> 2833.33333333333 | E36: of:=[$'Spring 2015'.H38] -> 2833.33333333333 | F36: of:=SUM([.C36:.E36]) -> 8500 | G36: of:=[.F36]/[.F$5] -> 0.00527551341929655
A37: College of Design Administration | C37: of:=[$'Summer 2014'.J39] -> 43680 | D37: of:=[$'Fall 2014'.H39] -> 58290 | E37: of:=[$'Spring 2015'.H39] -> 64320 | F37: of:=SUM([.C37:.E37]) -> 166290 | G37: of:=[.F37]/[.F$5] -> 0.103207661940567
A38: Study abroad fee | C38: of:=[$'Summer 2014'.J40] -> 23400 | D38: of:=[$'Fall 2014'.H40] -> 1045.94594594595 | E38: of:=[$'Spring 2015'.H40] -> 1045.94594594595 | F38: of:=SUM([.C38:.E38]) -> 25491.8918918919 | G38: of:=[.F38]/[.F$5] -> 0.0158215079716391
A39: Students | C39: of:=[$'Summer 2014'.J41] -> 90258.1216216216 | D39: of:=[$'Fall 2014'.H41] -> 146358.297297297 | E39: of:=[$'Spring 2015'.H41] -> 161498.810810811 | F39: of:=SUM([.C39:.E39]) -> 398115.22972973 | G39: of:=[.F39]/[.F$5] -> 0.247089674925355
A40: Program specific equip/suppl | C40: of:=[$'Summer 2014'.J42] -> 0 | D40: of:=[$'Fall 2014'.H42] -> 7000 | E40: of:=[$'Spring 2015'.H42] -> 13000 | F40: of:=SUM([.C40:.E40]) -> 20000 | G40: of:=[.F40]/[.F$5] -> 0.012412972751286
A41: per student costs | C41: of:=[$'Summer 2014'.J43] -> 0 | D41: of:=[$'Fall 2014'.H43] -> 146358.297297297 | E41: of:=[$'Spring 2015'.H43] -> 161498.810810811 | F41: of:=SUMPRODUCT([.C41:.E41];[.C$66:.E$66]) -> 18824705.1351351
B42: Other student expenses * | C42: of:=[$'Summer 2014'.J44] -> 6240 | D42: of:=[$'Fall 2014'.H44] -> 4640 | E42: of:=[$'Spring 2015'.H44] -> 5120 | F42: of:=SUMPRODUCT([.C42:.E42];[.C$66:.E$66]) -> 1083520 | G42: of:=[.F42]/[.F$5] -> 0.67248521177367
B43: Housing * | C43: of:=[$'Summer 2014'.J45] -> 40791.8918918919 | D43: of:=[$'Fall 2014'.H45] -> 60664.8648648649 | E43: of:=[$'Spring 2015'.H45] -> 66940.5405405405 | F43: of:=SUMPRODUCT([.C43:.E43];[.C$66:.E$66]) -> 10984524.3243243 | G43: of:=[.F43]/[.F$5] -> 6.81753005618379
B44: Orientation * | C44: of:=[$'Summer 2014'.J46] -> 1950 | D44: of:=[$'Fall 2014'.H46] -> 1450 | E44: of:=[$'Spring 2015'.H46] -> 1600 | F44: of:=SUMPRODUCT([.C44:.E44];[.C$66:.E$66]) -> 338600 | G44: of:=[.F44]/[.F$5] -> 0.210151628679272
B45: Travel pass * | C45: of:=[$'Summer 2014'.J47] -> 5649.72972972973 | D45: of:=[$'Fall 2014'.H47] -> 5392.43243243243 | E45: of:=[$'Spring 2015'.H47] -> 5950.27027027027 | F45: of:=SUMPRODUCT([.C45:.E45];[.C$66:.E$66]) -> 1134257.2972973 | G45: of:=[.F45]/[.F$5] -> 0.703975246214935
B46: Culture & Excursions * | C46: of:=[$'Summer 2014'.J48] -> 30888 | D46: of:=[$'Fall 2014'.H48] -> 67164 | E46: of:=[$'Spring 2015'.H48] -> 74112 | F46: of:=SUMPRODUCT([.C46:.E46];[.C$66:.E$66]) -> 11047944 | G46: of:=[.F46]/[.F$5] -> 6.85689139148668
B47: Health Insurance * | C47: of:=[$'Summer 2014'.J49] -> 4738.5 | D47: of:=[$'Fall 2014'.H49] -> 7047 | E47: of:=[$'Spring 2015'.H49] -> 7776 | F47: of:=SUMPRODUCT([.C47:.E47];[.C$66:.E$66]) -> 1275993 | G47: of:=[.F47]/[.F$5] -> 0.791943316991584
A48: Faculty | C48: of:=[$'Summer 2014'.J50] -> 149740.608108108 | D48: of:=[$'Fall 2014'.H50] -> 61961.4736842105 | E48: of:=[$'Spring 2015'.H50] -> 118697.444444444 | F48: of:=SUM([.C48:.E48]) -> 330399.526236763 | G48: of:=[.F48]/[.F$5] -> 0.205062015810737
A49: Czech | C49: of:=[$'Summer 2014'.J51] -> 15192 | D49: of:=[$'Fall 2014'.H51] -> 34695.4736842105 | E49: of:=[$'Spring 2015'.H51] -> 82298.4444444445 | F49: of:=SUM([.C49:.E49]) -> 132185.918128655 | G49: of:=[.F49]/[.F$5] -> 0.0820410099917358
B50: Salaries | C50: of:=[$'Summer 2014'.J52] -> 6200 | D50: of:=[$'Fall 2014'.H52] -> 15000 | E50: of:=[$'Spring 2015'.H52] -> 67244.4444444444 | F50: of:=SUM([.C50:.E50]) -> 88444.4444444444 | G50: of:=[.F50]/[.F$5] -> 0.0548929239445758
B51: Other | C51: of:=[$'Summer 2014'.J53] -> 792 | D51: of:=[$'Fall 2014'.H53] -> 4932 | E51: of:=[$'Spring 2015'.H53] -> 12738 | F51: of:=SUM([.C51:.E51]) -> 18462 | G51: of:=[.F51]/[.F$5] -> 0.0114584151467121
A52: Guests | C52: of:=[$'Summer 2014'.J54] -> 0 | D52: of:=[$'Fall 2014'.H54] -> 0 | E52: of:=[$'Spring 2015'.H54] -> 0 | F52: of:=SUM([.C52:.E52]) -> 0
B53: Salaries | C53: of:=[$'Summer 2014'.J55] -> 8200 | D53: of:=[$'Fall 2014'.H55] -> 0 | E53: of:=[$'Spring 2015'.H55] -> 0 | F53: of:=SUM([.C53:.E53]) -> 8200 | G53: of:=[.F53]/[.F$5] -> 0.00508931882802726
B54: Other | C54: of:=[$'Summer 2014'.J56] -> 0 | D54: of:=[$'Fall 2014'.H56] -> 0 | E54: of:=[$'Spring 2015'.H56] -> 0 | F54: of:=SUM([.C54:.E54]) -> 0 | G54: of:=[.F54]/[.F$5] -> 0
A55: US | C55: of:=[$'Summer 2014'.J57] -> 134548.608108108 | D55: of:=[$'Fall 2014'.H57] -> 27266 | E55: of:=[$'Spring 2015'.H57] -> 36399 | F55: of:=SUM([.C55:.E55]) -> 198213.608108108 | G55: of:=[.F55]/[.F$5] -> 0.123021005819001
B56: Workshop total | C56: of:=[$'Summer 2014'.J58] -> -1500 | D56: of:=[$'Fall 2014'.H58] -> 3000 | E56: of:=[$'Spring 2015'.H58] -> 0 | F56: of:=SUM([.C56:.E56]) -> 1500
A57: per faculty | C57: of:=[$'Summer 2014'.J59] -> 136048.608108108 | D57: of:=[$'Fall 2014'.H59] -> 24266 | E57: of:=[$'Spring 2015'.H59] -> 36399 | F57: of:=SUM([.C57:.E57]) -> 196713.608108108 | G57: of:=[.F57]/[.F$5] -> 0.122090032862655
B58: Salaries + benefit ** | C58: of:=[$'Summer 2014'.J60] -> 57000 | D58: of:=[$'Fall 2014'.H60] -> 12000 | E58: of:=[$'Spring 2015'.H60] -> 18000 | F58: of:=SUM([.C58:.E58]) -> 87000 | G58: of:=[.F58]/[.F$5] -> 0.0539964314680941
B59: Travel** | C59: of:=[$'Summer 2014'.J61] -> 21748.6486486486 | D59: of:=[$'Fall 2014'.H61] -> 3200 | E59: of:=[$'Spring 2015'.H61] -> 4800 | F59: of:=SUM([.C59:.E59]) -> 29748.6486486486 | G59: of:=[.F59]/[.F$5] -> 0.0184634582531628
B60: Perdiem** | C60: of:=[$'Summer 2014'.J62] -> 21937.5 | D60: of:=[$'Fall 2014'.H62] -> 6750 | E60: of:=[$'Spring 2015'.H62] -> 10125 | F60: of:=SUM([.C60:.E60]) -> 38812.5 | G60: of:=[.F60]/[.F$5] -> 0.0240889252454644
B61: Culture & Excursions ** | C61: of:=[$'Summer 2014'.J63] -> 5148 | D61: of:=[$'Fall 2014'.H63] -> 2316 | E61: of:=[$'Spring 2015'.H63] -> 3474 | F61: of:=SUM([.C61:.E61]) -> 10938 | G61: of:=[.F61]/[.F$5] -> 0.00678865479767831
B62: Housing** | C62: of:=[$'Summer 2014'.J64] -> 28459.4594594595 | D62: of:=[$'Fall 2014'.H64] -> 0 | E62: of:=[$'Spring 2015'.H64] -> 0 | F62: of:=SUM([.C62:.E62]) -> 28459.4594594595 | G62: of:=[.F62]/[.F$5] -> 0.01766332473933
B63: Health insurance** | C63: of:=[$'Summer 2014'.J65] -> 1755 | D63: of:=[$'Fall 2014'.H65] -> 0 | E63: of:=[$'Spring 2015'.H65] -> 0 | F63: of:=SUM([.C63:.E63]) -> 1755 | G63: of:=[.F63]/[.F$5] -> 0.00108923835892535
A65: Other info
A66: No. of students | C66: of:=[$'Summer 2014'.J72] -> 78 | D66: of:=[$'Fall 2014'.H72] -> 58 | E66: of:=[$'Spring 2015'.H72] -> 64
A68: of:=[.A1] -> 14B-15A Budget | C68: INCOME
C70: of:=[.C3] -> 14B | D70: of:=[.D3] -> 14C | E70: of:=[.E3] -> 15A | F70: TOTAL
A71: TOTAL | C71: of:=[$'Summer 2014'.J82] -> 436800 | D71: of:=[$'Fall 2014'.H82] -> 582900 | E71: of:=[$'Spring 2015'.H82] -> 643200 | F71: of:=SUM([.C71:.E71]) -> 1662900

Sheet: Constants
A1: Global numbers
A3: USD / CZK minimum | C3: 18.5
A4: Housing cost / day / student | B4: Domov | C4: 330 | D4: CZK | E4: Domov
A5: Housing cost / day / student | B5: Botič | C5: 215 | D5: CZK | E5: Botic
B7: cista | C7: hruba
A8: konst | B8: 0.76 | C8: of:=[.C9]/[.$C9] -> 1 | D8: 1.34
A9: DR | B9: of:=[.B$8]*[.$C9] -> 53.2 | C9: 70 | D9: of:=[.D$8]*[.$C9] -> 93.8 | E9: of:=[.B9]/USDCZK*1000 -> 2875.67567567568 | F9: of:=[.C9]/USDCZK*1000 -> 3783.78378378378 | G9: of:=[.D9]/USDCZK*1000 -> 5070.27027027027 | H9: of:=[.C9]/USDCZK*1000*12 -> 45405.4054054054 | I9: of:=[.J9]/[.H9]-1 -> -0.00892857142857151 | J9: 45000 | K9: 67.5 | L9: 75
A10: MS | B10: of:=[.B$8]*[.$C10] -> 22.8 | C10: 30 | D10: of:=[.D$8]*[.$C10] -> 40.2 | E10: of:=[.B10]/USDCZK*1000 -> 1232.43243243243 | F10: of:=[.C10]/USDCZK*1000 -> 1621.62162162162 | G10: of:=[.D10]/USDCZK*1000 -> 2172.97297297297 | H10: of:=[.C10]/USDCZK*1000*12 -> 19459.4594594595 | I10: of:=[.J10]/[.H10]-1 -> 0.15625 | J10: of:=45000/2 -> 22500 | K10: 30 | L10: 33.7
A11: AS | B11: of:=[.B$8]*[.$C11] -> 70.68 | C11: 93 | D11: of:=[.D$8]*[.$C11] -> 124.62 | E11: of:=[.B11]/USDCZK*1000 -> 3820.54054054054 | F11: of:=[.C11]/USDCZK*1000 -> 5027.02702702703 | G11: of:=[.D11]/USDCZK*1000 -> 6736.21621621622 | H11: of:=[.C11]/USDCZK*1000*12 -> 60324.3243243243 | I11: of:=[.J11]/[.H11]-1 -> -0.00537634408602172 | J11: 60000 | K11: 90 | L11: 97.5
A12: JT | B12: of:=[.B$8]*[.$C12] -> 70.68 | C12: 93 | D12: of:=[.D$8]*[.$C12] -> 124.62 | E12: of:=[.B12]/USDCZK*1000 -> 3820.54054054054 | F12: of:=[.C12]/USDCZK*1000 -> 5027.02702702703 | G12: of:=[.D12]/USDCZK*1000 -> 6736.21621621622 | H12: of:=[.C12]/USDCZK*1000*12 -> 60324.3243243243 | I12: of:=[.J12]/[.H12]-1 -> -0.00537634408602172 | J12: 60000 | K12: 90 | L12: 97.5
A13: AŠ | B13: of:=[.B$8]*[.$C13] -> 51.3 | C13: of:=67.5 -> 67.5 | D13: of:=[.D$8]*[.$C13] -> 90.45 | E13: of:=[.B13]/USDCZK*1000 -> 2772.97297297297 | F13: of:=[.C13]/USDCZK*1000 -> 3648.64864864865 | G13: of:=[.D13]/USDCZK*1000 -> 4889.18918918919 | H13: of:=[.C13]/USDCZK*1000*12 -> 43783.7837837838 | I13: of:=[.J13]/[.H13]-1 -> 0.0277777777777777 | J13: 45000 | K13: 67.5 | L13: 67.5
A15: Directors secretary E1 | B15: of:=[.B$8]*[.$C15] -> 0 | C15: 0 | D15: of:=[.D$8]*[.$C15] -> 0 | E15: of:=[.B15]/USDCZK*1000 -> 0 | F15: of:=[.C15]/USDCZK*1000 -> 0 | G15: of:=[.D15]/USDCZK*1000 -> 0 | I15: of:=AVERAGE([.I9:.I13]) -> 0.0328693036354325
B16: of:=SUM([.B9:.B15]) -> 268.66 | D16: of:=SUM([.D9:.D15]) -> 473.69 | E16: of:=SUM([.E9:.E15]) -> 14522.1621621622 | F16: of:=SUM([.F9:.F15]) -> 19108.1081081081 | G16: of:=SUM([.G9:.G15]) -> 25604.8648648649
D17: of:=[.D16]-[.B16] -> 205.03 | G17: of:=[.G16]-[.E16] -> 11082.7027027027
A19: Student residant assistant | B19: of:=[.B$8]*[.$C19] -> 20.52 | C19: of:=6*4.5 -> 27 | D19: of:=[.D$8]*[.$C19] -> 36.18 | E19: of:=[.B19]/USDCZK*1000 -> 1109.18918918919 | F19: of:=[.C19]/USDCZK*1000 -> 1459.45945945946 | G19: of:=[.D19]/USDCZK*1000 -> 1955.67567567568
A20: US employee | C20: of:=20000*USDCZK/12/1000 -> 30.8333333333333 | E20: of:=[.B20]/USDCZK*1000 -> 0 | F20: of:=[.C20]/USDCZK*1000 -> 1666.66666666667 | G20: of:=[.D20]/USDCZK*1000 -> 0
A21: Directors secretary E1 | B21: of:=[.B$8]*[.$C21] -> 25.08 | C21: 33 | D21: of:=[.D$8]*[.$C21] -> 44.22 | E21: of:=[.B21]/USDCZK*1000 -> 1355.67567567568 | F21: of:=[.C21]/USDCZK*1000 -> 1783.78378378378 | G21: of:=[.D21]/USDCZK*1000 -> 2390.27027027027
A22: partime accounting E2 | B22: of:=[.B$8]*[.$C22] -> 12.92 | C22: 17 | D22: of:=[.D$8]*[.$C22] -> 22.78 | E22: of:=[.B22]/USDCZK*1000 -> 698.378378378378 | F22: of:=[.C22]/USDCZK*1000 -> 918.918918918919 | G22: of:=[.D22]/USDCZK*1000 -> 1231.35135135135
A25: up to 2011
B27: cista | C27: hruba
A28: konst | B28: of:=[.B29]/[.$C29] -> 0.761851851851852 | C28: of:=[.C29]/[.$C29] -> 1 | D28: of:=[.D29]/[.$C29] -> 1.34
A29: Student affairs | B29: 20.57 | C29: 27 | D29: 36.18 | E29: of:=[.B29]/USDCZK*1000 -> 1111.89189189189 | F29: of:=[.C29]/USDCZK*1000 -> 1459.45945945946 | G29: of:=[.D29]/USDCZK*1000 -> 1955.67567567568
A30: Mi | B30: of:=[.B$28]*[.$C30] -> 9.52314814814815 | C30: of:=25/2 -> 12.5 | D30: of:=[.D$28]*[.$C30] -> 16.75 | E30: of:=[.B30]/USDCZK*1000 -> 514.764764764765 | F30: of:=[.C30]/USDCZK*1000 -> 675.675675675676 | G30: of:=[.D30]/USDCZK*1000 -> 905.405405405405
A31: AS | B31: of:=[.B$28]*[.$C31] -> 15.237037037037 | C31: of:=50/5*2 -> 20 | D31: of:=[.D$28]*[.$C31] -> 26.8 | E31: of:=[.B31]/USDCZK*1000 -> 823.623623623624 | F31: of:=[.C31]/USDCZK*1000 -> 1081.08108108108 | G31: of:=[.D31]/USDCZK*1000 -> 1448.64864864865
A32: JT | B32: of:=[.B$28]*[.$C32] -> 19.8081481481481 | C32: of:=19+7 -> 26 | D32: of:=[.D$28]*[.$C32] -> 34.84 | E32: of:=[.B32]/USDCZK*1000 -> 1070.71071071071 | F32: of:=[.C32]/USDCZK*1000 -> 1405.40540540541 | G32: of:=[.D32]/USDCZK*1000 -> 1883.24324324324
A33: AŠ | B33: of:=[.B$28]*[.$C33] -> 23.6174074074074 | C33: 31 | D33: of:=[.D$28]*[.$C33] -> 41.54 | E33: of:=[.B33]/USDCZK*1000 -> 1276.61661661662 | F33: of:=[.C33]/USDCZK*1000 -> 1675.67567567568 | G33: of:=[.D33]/USDCZK*1000 -> 2245.40540540541
A34: us emp
A35: diff | C35: 8 | D35: of:=[.D$28]*[.$C35] -> 10.72
C37: of:=5000/[.B28] -> 6562.95576081672

Sheet: 2014-15
B1: summer | C1: fall | D1: spring
B2: 14B | C2: 14C | D2: 15A | E2: total
A3: BALANCE | B3: of:=[.B5]-[.B4] -> -97271.2475106678 | C3: of:=[.C5]-[.C4] -> 83280.072546231 | D3: of:=[.D5]-[.D4] -> 65673.5882724833 | E3: of:=SUM([.B3:.D3]) -> 51682.4133080465
A4: TOTAL COST | B4: of:=[$'Summer 2014'.J5] -> 534071.247510668 | C4: of:=[$'Fall 2014'.H5] -> 499619.927453769 | D4: of:=[$'Spring 2015'.H5] -> 577526.411727517 | E4: of:=SUM([.B4:.D4]) -> 1611217.58669195
A5: TOTAL REVENUE | B5: of:=[$'Summer 2014'.J6] -> 436800 | C5: of:=[$'Fall 2014'.H6] -> 582900 | D5: of:=[$'Spring 2015'.H6] -> 643200 | E5: of:=SUM([.B5:.D5]) -> 1662900
A7: US cost | B7: of:=[$'Summer 2014'.J37] -> 69913.3333333333 | C7: of:=[$'Fall 2014'.H37] -> 62169.2792792793 | D7: of:=[$'Spring 2015'.H37] -> 68199.2792792793 | E7: of:=SUM([.B7:.D7]) -> 200281.891891892
A12: supplies | B12: 2012 | C12: 10200 | D12: 2013 | E12: 21000 | F12: 2014 | G12: 3500
A13: stweeks | B13: of:=21*13+79*6+38*13 -> 1241 | C13: of:=[.C$12]/[.B13] -> 8.21917808219178 | D13: 1635 | E13: of:=[.E$12]/[.D13] -> 12.8440366972477 | F13: of:=64*13 -> 832 | G13: of:=[.G$12]/[.F13] -> 4.20673076923077
A14: st | B14: of:=21+79+38 -> 138 | C14: of:=[.C$12]/[.B14] -> 73.9130434782609 | D14: 158 | E14: of:=[.E$12]/[.D14] -> 132.911392405063 | F14: of:=64 -> 64 | G14: of:=[.G$12]/[.F14] -> 54.6875
A16: culture | B16: 2012 | C16: 60000 | D16: 2013 | E16: 107460 | F16: 2014 | G16: 35000
A17: stweeks | B17: of:=21*13+79*6+38*13 -> 1241 | C17: of:=[.C$16]/[.B17] -> 48.348106365834 | D17: 1635 | E17: of:=[.E$16]/[.D17] -> 65.7247706422018 | F17: of:=64*13 -> 832 | G17: of:=[.G$16]/[.F17] -> 42.0673076923077
A18: st | B18: of:=21+79+38 -> 138 | C18: of:=[.C$16]/[.B18] -> 434.782608695652 | D18: 158 | E18: of:=[.E$16]/[.D18] -> 680.126582278481 | F18: of:=64 -> 64 | G18: of:=[.G$16]/[.F18] -> 546.875